id,partidaId,timeId,jogadorId,tempo,minuto,minutoGeral,jogador,time,horarioInt,horarioString
704,166,4,704,2,14:00,59,Daniel de Melo Araujo Junior,Vitória,1364,22:44
705,166,13,705,2,16:00,61,Christian Chagas Tarouco,Fortaleza,1366,22:46
706,167,16,706,1,15:00,15,Adriano Martins da Fonseca  Goianiense Saf,Atlético,1155,19:15
707,167,16,707,1,31:00,31,Janderson Santos de Souza  Goianiense Saf,Atlético,1171,19:31
708,168,19,708,1,22:00,22,Jean Carlos Vicente,Juventude,1162,19:22
709,168,19,709,2,24:00,69,Abner Salles da Silva,Juventude,1224,20:24
710,169,4,710,1,16:00,16,Lucas Willians Assis Arcanjo,Vitória,676,11:16
711,169,4,711,1,22:00,22,Leonardo Naldi de Matos,Vitória,682,11:22
712,169,4,712,1,34:00,34,Janderson de Carvalho Costa,Vitória,694,11:34
713,169,9,713,1,45:00,45,Felipe Ignacio Carballo Ares,Grêmio,705,11:45
714,169,4,714,2,06:00,51,Lawan Kennyd Gabriel Santos,Vitória,726,12:06
715,169,4,715,2,14:00,59,Willian Osmar de Oliveira Silva,Vitória,734,12:14
716,170,11,716,2,01:00,46,Junior Osmar Ignacio Alonso Mujica,Atlético Mineiro Saf,1021,17:01
717,171,1,717,1,27:00,27,Caio Alexandre Sousa E Silva,Bahia,987,16:27
718,171,10,718,1,35:00,35,Ryan Gustavo de Lima,Corinthians,995,16:35
719,171,1,719,1,36:00,36,Gabriel Teixeira Aragao,Bahia,996,16:36
720,171,10,720,1,37:00,37,Gustavo Henrique Vernes,Corinthians,997,16:37
721,171,1,721,2,08:00,53,Victor Leandro Cuesta,Bahia,1028,17:08
722,171,1,722,2,19:00,64,Victor Hugo Soares dos Santos,Bahia,1039,17:19
723,172,18,723,1,38:00,38,Rodrigo Fagundes de Freitas,Criciúma,998,16:38
724,172,18,724,2,02:00,47,Claudio Coelho Salvatico,Criciúma,1022,17:02
725,172,17,725,2,05:00,50,David Luiz Moreira Marinho,Flamengo,1025,17:05
726,172,18,726,2,16:00,61,Alisson Machado dos Santos,Criciúma,1036,17:16
727,172,18,727,2,16:00,61,Allano Brendon de Souza Lima,Criciúma,1036,17:16
728,172,17,728,2,25:00,70,Matias Nicolas Vi,Flamengo,1045,17:25
729,172,18,729,2,40:00,85,Gustavo Bonatto Barreto,Criciúma,1060,17:40
730,172,18,730,2,41:00,86,Eder Citadin Martins,Criciúma,1061,17:41
731,172,17,731,2,43:00,88,Gabriel Barbosa Almeida,Flamengo,1063,17:43
732,173,3,732,1,32:00,32,Luis Eduardo Soares da Silva,Botafogo,1142,19:02
733,173,0,733,2,03:00,48,Romulo Zanre Zwarg,Internacional,1173,19:33
734,173,3,734,2,06:00,51,Damian Nicolas Su,Botafogo,1176,19:36
735,173,0,735,2,31:00,76,Igor Gomes Silva,Internacional,1201,20:01
736,173,3,736,2,32:00,77,Jefferson David Savarino Quintero,Botafogo,1202,20:02
737,173,3,737,2,36:00,81,John Victor Maciel Furtado,Botafogo,1206,20:06
738,174,2,738,1,37:00,37,Alvaro Martin Barreal,Cruzeiro Saf,1297,21:37
739,174,5,739,2,14:00,59,Jose Manuel Alberto Lopez,Palmeiras,1334,22:14
740,174,5,740,2,15:00,60,Raphael Cavalcante Veiga,Palmeiras,1335,22:15
741,174,5,741,2,24:00,69,Jose Rafael Vivian,Palmeiras,1344,22:24
742,174,2,742,2,24:00,69,Matheus Fellipe Costa Pereira,Cruzeiro Saf,1344,22:24
743,174,5,743,2,31:00,76,Mauricio Magalhaes Prado,Palmeiras,1351,22:31
744,175,7,744,1,17:00,17,Eduardo Gonzaga Mendes Santos,Red Bull Bragantino,1127,18:47
745,175,14,745,2,10:00,55,Christian Roberto Alves Cardoso,Athletico Paranaense,1180,19:40
746,175,14,746,2,24:00,69,Agustin Canobbio Graviz,Athletico Paranaense,1194,19:54
747,175,14,747,2,41:00,86,Mateo Gamarra Gonzalez,Athletico Paranaense,1211,20:11
748,175,14,748,2,41:00,86,Kaique Rocha Lima,Athletico Paranaense,1211,20:11
749,175,14,749,2,42:00,87,Tomas Esteban Cuello,Athletico Paranaense,1212,20:12
750,175,7,750,2,42:00,87,Pedro Henrique Ribeiro Goncalves,Red Bull Bragantino,1212,20:12
751,176,16,751,1,27:00,27,Janderson Santos de Souza  Goianiense Saf,Atlético,1137,18:57
752,176,13,752,1,38:00,38,Hercules Pereira do Nascimento,Fortaleza,1148,19:08
753,176,16,753,2,01:00,46,Rhaldney Norberto Simi,Atlético,1171,19:31
754,176,13,754,2,10:00,55,Breno Henrique Vasconcelos Lopes,Fortaleza,1180,19:40
755,176,16,755,2,12:00,57,Ronaldo de Oliveira Strada  Goianiense Saf,Atlético,1182,19:42
756,177,15,756,2,22:00,67,Ramon Ramos Lima,Cuiabá Saf,1282,21:22
757,177,6,757,2,43:00,88,Jhon Adolfo Arias Andrade,Fluminense,1303,21:43
758,178,12,758,1,10:00,10,Alan Javier Franco,São Paulo,1120,18:40
759,178,12,759,1,18:00,18,Luciano da Rocha Neves,São Paulo,1128,18:48
760,178,19,760,1,26:00,26,Jadson Alves dos Santos,Juventude,1136,18:56
761,178,19,761,1,34:00,34,Rodrigo Eduardo da Silva,Juventude,1144,19:04
762,178,19,762,2,05:00,50,Joao Lucas de Almeida Carvalho,Juventude,1175,19:35
763,179,13,763,1,31:00,31,Glaybson Yago Souza Lisboa,Fortaleza,1201,20:01
764,179,13,764,1,41:00,41,Guilherme de Jesus da Silva,Fortaleza,1211,20:11
765,179,0,765,1,45:00,45,Fernando Francisco Reges,Internacional,1215,20:15
766,179,13,766,2,23:00,68,Leandro Emmanuel Martinez,Fortaleza,1253,20:53
767,179,13,767,2,31:00,76,Emanuel Britez,Fortaleza,1261,21:01
768,179,13,768,2,38:00,83,Christian Chagas Tarouco,Fortaleza,1268,21:08
769,180,19,769,1,43:00,43,Gabriel de Souza Inocencio,Juventude,1183,19:43
770,180,19,770,2,17:00,62,Jose Marcos Alves Luis,Juventude,1217,20:17
771,180,2,771,2,23:00,68,Jose Ivaldo Almeida Silva,Cruzeiro Saf,1223,20:23
772,180,2,772,2,27:00,72,Joao Marcelo Messias Ferreira,Cruzeiro Saf,1227,20:27
773,180,19,773,2,27:00,72,Joao Lucas de Almeida Carvalho,Juventude,1227,20:27
774,180,2,774,2,32:00,77,William de Asevedo Furtado,Cruzeiro Saf,1232,20:32
775,180,19,775,2,42:00,87,Anderson Luis de Carvalho,Juventude,1242,20:42
776,181,4,776,2,12:00,57,Lucas Esteves Souza,Vitória,1272,21:12
777,181,17,777,2,32:00,77,Luiz de Araujo Guimaraes Neto,Flamengo,1292,21:32
778,182,6,778,1,18:00,18,Thiago dos Santos,Fluminense,1308,21:48
779,182,5,779,1,30:00,30,Gustavo Raul Gomez Portillo,Palmeiras,1320,22:00
780,182,6,780,1,41:00,41,Paulo Henrique Chagas de Lima,Fluminense,1331,22:11
781,182,5,781,1,42:00,42,Raphael Cavalcante Veiga,Palmeiras,1332,22:12
782,182,5,782,2,11:00,56,Jose Rafael Vivian,Palmeiras,1361,22:41
783,183,15,783,2,44:00,89,Derik Gean Severino Lacerda,Cuiabá Saf,1244,20:44
784,184,9,784,1,30:00,30,Pedro Tonon Geromel,Grêmio,1230,20:30
785,184,9,785,1,33:00,33,Rodrigo Ely,Grêmio,1233,20:33
786,184,10,786,1,39:00,39,Carlos de Menezes Junior,Corinthians,1239,20:39
787,185,12,787,1,24:00,24,Marcio Rafael Ferreira de Souza,São Paulo,1194,19:54
788,185,3,788,1,38:00,38,Gregore de Magalhaes Silva,Botafogo,1208,20:08
789,185,12,789,2,06:00,51,Lucas Rodrigues Moura da Silva,São Paulo,1236,20:36
790,185,3,790,2,17:00,62,Marlon Rodrigues Freitas,Botafogo,1247,20:47
791,185,3,791,2,18:00,63,Luis Eduardo Soares da Silva,Botafogo,1248,20:48
792,185,12,792,2,30:00,75,Luciano da Rocha Neves,São Paulo,1260,21:00
793,186,16,793,1,34:00,34,Gonzalo Gaston Freitas Silva  Goianiense Saf,Atlético,1324,22:04
794,186,1,794,1,37:00,37,Everaldo Stum,Bahia,1327,22:07
795,186,1,795,1,38:00,38,Victor Leandro Cuesta,Bahia,1328,22:08
796,186,1,796,2,30:00,75,Julio Cesar de Rezende Miranda,Bahia,1380,23:00
797,186,16,797,2,36:00,81,Alix Vinicius de Souza Sampaio  Goianiense Saf,Atlético,1386,23:06
798,186,16,798,2,41:00,86,Maswel Ananias Silva  Goianiense Saf,Atlético,1391,23:11
799,187,7,799,1,32:00,32,Jadsom Meemyas de Oliveira da Silva,Red Bull Bragantino,1202,20:02
800,187,18,800,1,39:00,39,Patrick de Paula Carreiro,Criciúma,1209,20:09
801,187,18,801,1,43:00,43,Walisson Moreira Farias Maia,Criciúma,1213,20:13
802,187,7,802,2,35:00,80,Gustavo Ribeiro Neves,Red Bull Bragantino,1265,21:05
803,188,9,803,2,22:00,67,Douglas Moreira Fagundes,Grêmio,1222,20:22
804,188,9,804,2,24:00,69,Walter Kannemann,Grêmio,1224,20:24
805,189,11,805,1,23:00,23,Bruno de Lara Fuchs,Atlético Mineiro Saf,1163,19:23
806,189,10,806,2,36:00,81,Hugo de Souza Nogueira,Corinthians,1236,20:36
807,190,0,807,2,15:00,60,Fabricio Tomas Bustos Sein,Internacional,1275,21:15
808,190,0,808,2,20:00,65,Sergio Ramon Rochet Alvarez,Internacional,1280,21:20
809,190,0,809,2,35:00,80,Gabriel Ivan Mercado,Internacional,1295,21:35
810,190,1,810,2,41:00,86,Gilberto Moraes Junior,Bahia,1301,21:41
811,191,16,811,1,14:00,14,Jan Carlos Hurtado Anchico  Goianiense Saf,Atlético,974,16:14
812,191,17,812,1,35:00,35,Erick Antonio Pulgar Farfan,Flamengo,995,16:35
813,191,16,813,1,36:00,36,Pedro Henrique Pereira da Silva  Goianiense Saf,Atlético,996,16:36
814,191,17,814,2,28:00,73,Luiz de Araujo Guimaraes Neto,Flamengo,1048,17:28
815,191,17,815,2,35:00,80,Pedro Guilherme Abreu dos Santos,Flamengo,1055,17:35
816,192,3,816,1,03:00,3,Fernando Marcal de Oliveira,Botafogo,1293,21:33
817,192,2,817,1,30:00,30,William de Asevedo Furtado,Cruzeiro Saf,1320,22:00
818,192,2,818,2,26:00,71,Cassio Ramos,Cruzeiro Saf,1376,22:56
819,192,3,819,2,28:00,73,Allan Marques Loureiro,Botafogo,1378,22:58
820,193,4,820,1,27:00,27,Muriel Gustavo Becker,Vitória,1167,19:27
821,193,4,821,1,35:00,35,Lucas Esteves Souza,Vitória,1175,19:35
822,193,4,822,2,05:00,50,Osvaldo Lourenco Filho,Vitória,1205,20:05
823,193,5,823,2,05:00,50,Gabriel Vinicius Menino,Palmeiras,1205,20:05
824,193,4,824,2,27:00,72,Lucas Eduardo Ribeiro de Souza,Vitória,1227,20:27
825,193,4,825,2,34:00,79,Janderson de Carvalho Costa,Vitória,1234,20:34
826,193,5,826,2,44:00,89,Jose Manuel Alberto Lopez,Palmeiras,1244,20:44
827,194,7,827,2,40:00,85,Luan Candido de Almeida,Red Bull Bragantino,760,12:40
828,195,12,828,1,12:00,12,Luciano da Rocha Neves,São Paulo,1302,21:42
829,195,12,829,2,12:00,57,Welington Damascena Santos,São Paulo,1362,22:42
830,195,13,830,2,20:00,65,Emanuel Britez,Fortaleza,1370,22:50
831,195,12,831,2,24:00,69,Damian Josue Bobadilla Benitez,São Paulo,1374,22:54
832,195,13,832,2,34:00,79,Kervin Mario Andrade Navarro,Fortaleza,1384,23:04
833,195,13,833,2,43:00,88,Hercules Pereira do Nascimento,Fortaleza,1393,23:13
834,196,14,834,2,12:00,57,Julimar Silva Oliveira Junior,Athletico Paranaense,1212,20:12
835,196,14,835,2,41:00,86,Leonardo Ezequiel Godoy,Athletico Paranaense,1241,20:41
836,197,18,836,1,30:00,30,Wilker Jos,Criciúma,1170,19:30
837,197,19,837,2,13:00,58,Lucas Henrique Barbosa,Juventude,1213,20:13
838,197,18,838,2,23:00,68,Rodrigo Fagundes de Freitas,Criciúma,1223,20:23
839,199,13,839,1,28:00,28,Mario Sergio Santos Costa,Fortaleza,1288,21:28
840,199,13,840,1,31:00,31,Breno Henrique Vasconcelos Lopes,Fortaleza,1291,21:31
841,199,2,841,2,12:00,57,Jose Ivaldo Almeida Silva,Cruzeiro Saf,1332,22:12
842,199,2,842,2,21:00,66,Lautaro Ariel Diaz,Cruzeiro Saf,1341,22:21
843,199,13,843,2,45:00,90,Joao Ricardo Riedi,Fortaleza,1365,22:45
844,200,4,844,1,32:00,32,Janderson de Carvalho Costa,Vitória,992,16:32
845,200,4,845,2,07:00,52,Luan Vinicius da Silva Santos,Vitória,1027,17:07
846,200,15,846,2,20:00,65,Ramon Ramos Lima,Cuiabá Saf,1040,17:20
847,200,15,847,2,28:00,73,Derik Gean Severino Lacerda,Cuiabá Saf,1048,17:28
848,200,15,848,2,35:00,80,Filipe Augusto Carvalho Souza,Cuiabá Saf,1055,17:35
849,201,6,849,1,24:00,24,Diogo Barbosa Mendanha,Fluminense,984,16:24
850,201,6,850,1,35:00,35,Thiago dos Santos,Fluminense,995,16:35
851,201,6,851,2,16:00,61,Thiago Emiliano da Silva,Fluminense,1036,17:16
852,201,1,852,2,39:00,84,Carlos Maria de Pena Bonino,Bahia,1059,17:39
853,202,7,853,2,33:00,78,Lucas de Souza Cunha,Red Bull Bragantino,1233,20:33
854,203,10,854,1,28:00,28,Igor Caique Coronado,Corinthians,988,16:28
855,203,19,855,2,02:00,47,Jadson Alves dos Santos,Juventude,1022,17:02
856,203,19,856,2,06:00,51,Alan Luciano Ruschel,Juventude,1026,17:06
857,203,10,857,2,10:00,55,Rodrigo Garro,Corinthians,1030,17:10
858,204,12,858,1,32:00,32,Wellington Soares da Silva,São Paulo,1322,22:02
859,204,17,859,2,24:00,69,Matheus Gon,Flamengo,1374,22:54
860,204,17,860,2,29:00,74,David Luiz Moreira Marinho,Flamengo,1379,22:59
861,204,17,861,2,33:00,78,Bruno Henrique Pinto,Flamengo,1383,23:03
862,205,14,862,1,16:00,16,Mateo Gamarra Gonzalez,Athletico Paranaense,976,16:16
863,205,14,863,2,36:00,81,Tomas Esteban Cuello,Athletico Paranaense,1056,17:36
864,206,3,864,1,44:00,44,Igor Jesus Maciel da Cruz,Botafogo,1244,20:44
865,206,16,865,2,07:00,52,Guilherme Kennedy Romao  Goianiense Saf,Atlético,1267,21:07
866,206,16,866,2,14:00,59,Adriano Martins da Fonseca  Goianiense Saf,Atlético,1274,21:14
867,206,3,867,2,20:00,65,Allan Marques Loureiro,Botafogo,1280,21:20
868,206,3,868,2,32:00,77,Luiz Henrique Andre Rosa da Silva,Botafogo,1292,21:32
869,206,16,869,2,45:00,90,Joel Nathaniel Campbell Samuels  Goianiense Saf,Atlético,1305,21:45
870,207,11,870,2,04:00,49,Otavio Henrique Passos Santos,Atlético Mineiro Saf,1264,21:04
871,207,11,871,2,18:00,63,Junior Osmar Ignacio Alonso Mujica,Atlético Mineiro Saf,1278,21:18
872,207,18,872,2,37:00,82,Fellipe Mateus de Sena Araujo,Criciúma,1297,21:37
873,208,14,873,1,30:00,30,Fernando Augusto Pereira Bueno Junior,Athletico Paranaense,1170,19:30
874,208,14,874,1,45:00,45,Mateo Gamarra Gonzalez,Athletico Paranaense,1185,19:45
875,208,0,875,2,08:00,53,Bruno Henrique Corsini,Internacional,1208,20:08
876,209,2,876,1,41:00,41,Kaio Jorge Pinto Ramos,Cruzeiro Saf,1331,22:11
877,209,11,877,2,12:00,57,Carlos Eduardo Amaral Pereira de Castro,Atlético Mineiro Saf,1362,22:42
878,209,2,878,2,12:00,57,Alvaro Martin Barreal,Cruzeiro Saf,1362,22:42
879,209,2,879,2,40:00,85,Matheus Henrique de Souza,Cruzeiro Saf,1390,23:10
880,210,4,880,2,03:00,48,Alerrandro Barra Mansa Realino de Souza,Vitória,1023,17:03
881,210,1,881,2,03:00,48,Victor Hugo Soares dos Santos,Bahia,1023,17:03
882,210,1,882,2,35:00,80,Caio Alexandre Sousa E Silva,Bahia,1055,17:35
883,210,4,883,2,36:00,81,Pablo Santos de Alcantara,Vitória,1056,17:36
884,210,4,884,2,41:00,86,Willian Osmar de Oliveira Silva,Vitória,1061,17:41
885,210,1,885,2,45:00,90,Yago Felipe da Costa Rocha,Bahia,1065,17:45
886,211,5,886,1,13:00,13,Anibal Ismael Moreno,Palmeiras,973,16:13
887,211,17,887,1,21:00,21,Erick Antonio Pulgar Farfan,Flamengo,981,16:21
888,211,5,888,1,41:00,41,Murilo Cerqueira Paim,Palmeiras,1001,16:41
889,211,5,889,2,05:00,50,Gustavo Raul Gomez Portillo,Palmeiras,1025,17:05
890,212,6,890,1,42:00,42,Paulo Henrique Chagas de Lima,Fluminense,1332,22:12
891,212,6,891,2,10:00,55,Alexsander Cristhian Gomes da Costa,Fluminense,1360,22:40
892,212,6,892,2,33:00,78,Jhon Adolfo Arias Andrade,Fluminense,1383,23:03
893,213,10,893,1,20:00,20,Angel Rodrigo Romero Villamayor,Corinthians,1310,21:50
894,213,7,894,2,08:00,53,Raul L,Red Bull Bragantino,1358,22:38
895,213,7,895,2,11:00,56,Eduardo Colcenti Antunes,Red Bull Bragantino,1361,22:41
896,213,7,896,2,15:00,60,Lucas Alexandre Galdino de Azevedo,Red Bull Bragantino,1365,22:45
897,213,10,897,2,16:00,61,Hugo Ferreira de Farias,Corinthians,1366,22:46
898,213,7,898,2,42:00,87,Jadsom Meemyas de Oliveira da Silva,Red Bull Bragantino,1392,23:12
899,214,16,899,2,07:00,52,Gabriel Baralhas dos Santos  Goianiense Saf,Atlético,1027,17:07
900,214,12,900,2,13:00,58,Igor Matheus Liziero Pereira,São Paulo,1033,17:13
901,214,16,901,2,24:00,69,Guilherme Kennedy Romao  Goianiense Saf,Atlético,1044,17:24
902,215,13,902,1,13:00,13,Christian Chagas Tarouco,Fortaleza,973,16:13
903,215,18,903,1,43:00,43,Miguel Angel Trauco Saavedra,Criciúma,1003,16:43
904,215,13,904,2,24:00,69,Lucas Pacheco Affini,Fortaleza,1044,17:24
905,215,18,905,2,30:00,75,Marcos Gabriel do Nascimento,Criciúma,1050,17:30
906,216,9,906,2,25:00,70,Caique Luiz Santos da Purificacao,Grêmio,1225,20:25
907,216,9,907,2,28:00,73,Edenilson Andrade dos Santos,Grêmio,1228,20:28
908,217,19,908,1,13:00,13,Davi Goes Silva Ferreira Carvalho,Juventude,673,11:13
909,217,3,909,1,28:00,28,Oscar David Romero Villamayor,Botafogo,688,11:28
910,217,19,910,1,40:00,40,Erick Samuel Correa Farias,Juventude,700,11:40
911,217,3,911,1,41:00,41,Alexander Nahuel Barboza Ullua,Botafogo,701,11:41
912,217,3,912,2,27:00,72,Marlon Rodrigues Freitas,Botafogo,747,12:27
913,217,3,913,2,36:00,81,Fernando Marcal de Oliveira,Botafogo,756,12:36
914,217,19,914,2,40:00,85,Mateus Eduardo Claus,Juventude,760,12:40
915,218,1,915,2,19:00,64,Gabriel Lheman Xavier,Bahia,1039,17:19
916,218,9,916,2,22:00,67,Yeferson Julio Soteldo Martinez,Grêmio,1042,17:22
917,218,9,917,2,26:00,71,Diego da Silva Costa,Grêmio,1046,17:26
918,219,15,918,1,30:00,30,Lucas da Silva Izidoro,Cuiabá Saf,990,16:30
919,219,11,919,1,41:00,41,Mariano Ferreira Filho,Atlético Mineiro Saf,1001,16:41
920,219,11,920,1,43:00,43,Bruno de Lara Fuchs,Atlético Mineiro Saf,1003,16:43
921,219,15,921,2,04:00,49,Matheus Alexandre Anastacio de Souza,Cuiabá Saf,1024,17:04
922,219,15,922,2,26:00,71,Denilson Alves Borges,Cuiabá Saf,1046,17:26
923,219,15,923,2,34:00,79,Bruno Fabiano Alves,Cuiabá Saf,1054,17:34
924,219,15,924,2,44:00,89,Juan Pablo Vilela Tavares,Cuiabá Saf,1064,17:44
925,219,11,925,2,45:00,90,Alan Steven Franco Palma,Atlético Mineiro Saf,1065,17:45
926,220,4,926,2,32:00,77,Leonardo Naldi de Matos,Vitória,1292,21:32
927,220,2,927,2,37:00,82,Matheus Fellipe Costa Pereira,Cruzeiro Saf,1297,21:37
928,221,10,928,1,14:00,14,Charles Rigon Matos,Corinthians,1274,21:14
929,221,6,929,1,43:00,43,Andr,Fluminense,1303,21:43
930,221,6,930,2,43:00,88,Samuel Xavier Brito,Fluminense,1363,22:43
931,222,3,931,1,32:00,32,Luis Eduardo Soares da Silva,Botafogo,1142,19:02
932,222,3,932,2,06:00,51,Mateo Ponte Costa,Botafogo,1176,19:36
933,222,3,933,2,10:00,55,Alexander Nahuel Barboza Ullua,Botafogo,1180,19:40
934,222,17,934,2,19:00,64,Ayrton Lucas Dantas de Medeiros,Flamengo,1189,19:49
935,222,17,935,2,24:00,69,Carlos Moises de Lima,Flamengo,1194,19:54
936,222,3,936,2,41:00,86,Jefferson David Savarino Quintero,Botafogo,1211,20:11
937,223,12,937,1,42:00,42,Jose Sabino Chagas Monteiro,São Paulo,1002,16:42
938,223,5,938,1,45:00,45,Vitor de Oliveira Nunes dos Reis,Palmeiras,1005,16:45
939,223,5,939,2,15:00,60,Gustavo Raul Gomez Portillo,Palmeiras,1035,17:15
940,223,12,940,2,28:00,73,Luciano da Rocha Neves,São Paulo,1048,17:28
941,224,13,941,2,23:00,68,Christian Chagas Tarouco,Fortaleza,1193,19:53
942,224,7,942,2,42:00,87,Helio Junio Nunes de Castro,Red Bull Bragantino,1212,20:12
943,225,19,943,1,18:00,18,Jadson Alves dos Santos,Juventude,1128,18:48
944,225,14,944,1,22:00,22,Mateo Gamarra Gonzalez,Athletico Paranaense,1132,18:52
945,225,14,945,2,28:00,73,Gabriel Girotto Franco,Athletico Paranaense,1198,19:58
946,225,19,946,2,36:00,81,Alan Luciano Ruschel,Juventude,1206,20:06
947,225,14,947,2,40:00,85,Christian Roberto Alves Cardoso,Athletico Paranaense,1210,20:10
948,225,14,948,2,44:00,89,Bruno Zapelli,Athletico Paranaense,1214,20:14
949,226,16,949,2,08:00,53,Gonzalo Gaston Freitas Silva  Goianiense Saf,Atlético,1028,17:08
950,226,16,950,2,38:00,83,Pedro Felipe de Faria Rangel  Goianiense Saf,Atlético,1058,17:38
951,227,18,951,1,21:00,21,Allano Brendon de Souza Lima,Criciúma,981,16:21
952,227,18,952,1,43:00,43,Rodrigo Fagundes de Freitas,Criciúma,1003,16:43
953,227,18,953,2,36:00,81,Wilker Jos,Criciúma,1056,17:36
954,228,0,954,1,16:00,16,Wesley Ribeiro Silva,Internacional,1156,19:16
955,228,2,955,2,03:00,48,Lucas Daniel Romero,Cruzeiro Saf,1203,20:03
956,228,2,956,2,16:00,61,William de Asevedo Furtado,Cruzeiro Saf,1216,20:16
957,228,0,957,2,30:00,75,Sergio Ramon Rochet Alvarez,Internacional,1230,20:30
958,229,11,958,1,23:00,23,Bruno de Lara Fuchs,Atlético Mineiro Saf,1283,21:23
959,229,11,959,1,41:00,41,Lyanco Evangelista Silveira Neves Vojnovic,Atlético Mineiro Saf,1301,21:41
960,229,6,960,1,42:00,42,Paulo Henrique Chagas de Lima,Fluminense,1302,21:42
961,229,11,961,2,17:00,62,Rubens Antonio Dias,Atlético Mineiro Saf,1337,22:17
962,229,6,962,2,25:00,70,Matheus Martinelli Lima,Fluminense,1345,22:25
963,229,11,963,2,32:00,77,Guilherme Antonio Arana Lopes,Atlético Mineiro Saf,1352,22:32
964,229,11,964,2,35:00,80,Paulo Henrique Sampaio Filho,Atlético Mineiro Saf,1355,22:35
965,230,1,965,1,26:00,26,Jean Lucas de Souza Oliveira,Bahia,986,16:26
966,230,3,966,1,31:00,31,Gregore de Magalhaes Silva,Botafogo,991,16:31
967,230,1,967,1,34:00,34,Caio Alexandre Sousa E Silva,Bahia,994,16:34
968,230,3,968,1,34:00,34,Marlon Rodrigues Freitas,Botafogo,994,16:34
969,230,1,969,1,39:00,39,Marcos Felipe de Freitas Monteiro,Bahia,999,16:39
970,230,3,970,2,08:00,53,Lucas Halter,Botafogo,1028,17:08
971,230,1,971,2,26:00,71,Santiago Arias Naranjo,Bahia,1046,17:26
972,230,3,972,2,38:00,83,Fernando Marcal de Oliveira,Botafogo,1058,17:38
973,231,7,973,1,30:00,30,Jadsom Meemyas de Oliveira da Silva,Red Bull Bragantino,1230,20:30
974,231,17,974,2,21:00,66,Bruno Henrique Pinto,Flamengo,1281,21:21
975,232,14,975,1,14:00,14,Thiago Heleno Henrique Ferreira,Athletico Paranaense,1274,21:14
976,232,14,976,1,27:00,27,Jo,Athletico Paranaense,1287,21:27
977,233,5,977,2,07:00,52,Richard Rios Montoya,Palmeiras,1177,19:37
978,233,15,978,2,38:00,83,Clayson Henrique da Silva Vieira,Cuiabá Saf,1208,20:08
979,234,4,979,2,40:00,85,Willian Osmar de Oliveira Silva,Vitória,1210,20:10
980,234,4,980,2,41:00,86,Jose Hugo Sousa dos Santos,Vitória,1211,20:11
981,235,13,981,1,35:00,35,Hercules Pereira do Nascimento,Fortaleza,995,16:35
982,235,10,982,1,41:00,41,Gustavo Henrique Vernes,Corinthians,1001,16:41
983,235,13,983,2,09:00,54,Tomas Cardona,Fortaleza,1029,17:09
984,235,10,984,2,24:00,69,Charles Rigon Matos,Corinthians,1044,17:24
985,235,10,985,2,27:00,72,Andre Ramalho Silva,Corinthians,1047,17:27
986,235,13,986,2,36:00,81,Renato Kayzer de Souza,Fortaleza,1056,17:36
987,236,19,987,1,06:00,6,Carlos Eduardo de Souza Vieira,Juventude,966,16:06
988,236,16,988,1,08:00,8,Rhaldney Norberto Simi,Atlético,968,16:08
989,236,19,989,1,18:00,18,Jose Marcos Alves Luis,Juventude,978,16:18
990,236,16,990,1,44:00,44,Bruno Nunes de Barros  Goianiense Saf,Atlético,1004,16:44
991,236,19,991,1,45:00,45,Anderson Luis de Carvalho,Juventude,1005,16:45
992,236,16,992,2,09:00,54,Janderson Santos de Souza  Goianiense Saf,Atlético,1029,17:09
993,236,19,993,2,19:00,64,Danilo Boza Junior,Juventude,1039,17:19
994,236,16,994,2,44:00,89,Jorge de Moura Xavier  Goianiense Saf,Atlético,1064,17:44
995,237,18,995,1,19:00,19,Higor Matheus Meritao,Criciúma,979,16:19
996,237,9,996,1,40:00,40,Franco Sebastian Cristaldo,Grêmio,1000,16:40
997,237,18,997,2,10:00,55,Marcelo Hermes,Criciúma,1030,17:10
998,238,11,998,1,28:00,28,Bernard Anicio Caldeira Duarte,Atlético Mineiro Saf,688,11:28
999,238,11,999,1,39:00,39,Deyverson Brum Silva,Atlético Mineiro Saf,699,11:39
1000,238,9,1000,2,25:00,70,Walter Kannemann,Grêmio,745,12:25
1001,238,11,1001,2,32:00,77,Brahian Palacios Alzate,Atlético Mineiro Saf,752,12:32
1002,239,16,1002,2,03:00,48,Luiz Felipe do Nascimento dos Santos  Goianiense Saf,Atlético,723,12:03
1003,239,16,1003,2,14:00,59,Gabriel Baralhas dos Santos  Goianiense Saf,Atlético,734,12:14
1004,239,2,1004,2,18:00,63,Matheus Fellipe Costa Pereira,Cruzeiro Saf,738,12:18
1005,239,16,1005,2,21:00,66,Roni Medeiros de Moura  Goianiense Saf,Atlético,741,12:21
1006,239,2,1006,2,37:00,82,Cassio Ramos,Cruzeiro Saf,757,12:37
1007,239,16,1007,2,39:00,84,Emiliano Rodriguez Rosales  Goianiense Saf,Atlético,759,12:39
1008,240,4,1008,2,29:00,74,Hueglo dos Santos Neris,Vitória,1199,19:59
1009,240,4,1009,2,38:00,83,Willean Bernardo Willemen,Vitória,1208,20:08
1010,241,12,1010,1,31:00,31,Marcio Rafael Ferreira de Souza,São Paulo,1141,19:01
1011,241,12,1011,1,37:00,37,Jonathan Calleri,São Paulo,1147,19:07
1012,241,12,1012,1,41:00,41,Damian Josue Bobadilla Benitez,São Paulo,1151,19:11
1013,241,6,1013,2,04:00,49,Thiago dos Santos,Fluminense,1174,19:34
1014,241,6,1014,2,12:00,57,Facundo Bernal Cruz,Fluminense,1182,19:42
1015,241,6,1015,2,34:00,79,Marcos da Silva Franca,Fluminense,1204,20:04
1016,241,6,1016,2,40:00,85,Thiago Emiliano da Silva,Fluminense,1210,20:10
1017,242,13,1017,1,39:00,39,Tomas Cardona,Fortaleza,1299,21:39
1018,242,3,1018,1,43:00,43,Gregore de Magalhaes Silva,Botafogo,1303,21:43
1019,242,13,1019,2,03:00,48,Emanuel Britez,Fortaleza,1323,22:03
1020,242,3,1020,2,26:00,71,Bartolomeu Jacinto Quissanga,Botafogo,1346,22:26
1021,242,3,1021,2,45:00,90,Fernando Marcal de Oliveira,Botafogo,1365,22:45
1022,242,13,1022,2,45:00,90,Pedro Augusto Borges da Costa,Fortaleza,1365,22:45
1023,243,17,1023,1,07:00,7,Erick Antonio Pulgar Farfan,Flamengo,967,16:07
1024,243,17,1024,1,16:00,16,Ayrton Lucas Dantas de Medeiros,Flamengo,976,16:16
1025,243,10,1025,1,20:00,20,Talles Magno Bacelar Martins,Corinthians,980,16:20
1026,243,10,1026,1,29:00,29,Jose Andres Martinez Torres,Corinthians,989,16:29
1027,243,10,1027,2,02:00,47,Charles Rigon Matos,Corinthians,1022,17:02
1028,243,10,1028,2,16:00,61,Angel Rodrigo Romero Villamayor,Corinthians,1036,17:16
1029,243,17,1029,2,20:00,65,Allan Rodrigues de Souza,Flamengo,1040,17:20
1030,244,7,1030,1,19:00,19,Jhonatan dos Santos Rosa,Red Bull Bragantino,1129,18:49
1031,244,1,1031,1,28:00,28,Thaciano Mickael da Silva,Bahia,1138,18:58
1032,244,7,1032,1,29:00,29,Lincoln Henrique Oliveira dos Santos,Red Bull Bragantino,1139,18:59
1033,244,1,1033,1,33:00,33,Luciano Batista da Silva Junior,Bahia,1143,19:03
1034,244,1,1034,2,31:00,76,Victor Hugo Soares dos Santos,Bahia,1201,20:01
1035,245,14,1035,1,30:00,30,Christian Roberto Alves Cardoso,Athletico Paranaense,1140,19:00
1036,245,14,1036,1,45:00,45,Agustin Canobbio Graviz,Athletico Paranaense,1155,19:15
1037,245,5,1037,2,02:00,47,Marcos Luis Rocha Aquino,Palmeiras,1172,19:32
1038,246,15,1038,2,25:00,70,Fernando Pereira do Nascimento,Cuiabá Saf,1195,19:55
1039,246,15,1039,2,30:00,75,Isidro Miguel Pitta Saldivar,Cuiabá Saf,1200,20:00
1040,247,0,1040,1,03:00,3,Thiago Maia Alencar,Internacional,1113,18:33
1041,247,0,1041,2,22:00,67,Wesley Ribeiro Silva,Internacional,1192,19:52
1042,247,19,1042,2,30:00,75,Lucas Henrique Barbosa,Juventude,1200,20:00
1043,248,15,1043,1,12:00,12,Clayson Henrique da Silva Vieira,Cuiabá Saf,1212,20:12
1044,248,15,1044,1,12:00,12,Isidro Miguel Pitta Saldivar,Cuiabá Saf,1212,20:12
1045,248,0,1045,1,35:00,35,Gabriel Carvalho Teixeira,Internacional,1235,20:35
1046,249,12,1046,1,04:00,4,Nahuel Adolfo Ferraresi Hernandez,São Paulo,1114,18:34
1047,249,2,1047,1,18:00,18,Kaio Jorge Pinto Ramos,Cruzeiro Saf,1128,18:48
1048,249,2,1048,1,42:00,42,Matheus Henrique de Souza,Cruzeiro Saf,1152,19:12
