id,partidaId,timeId,jogadorId,tempo,minuto,minutoGeral,jogador,time,horarioInt,horarioString
727,140,19,773,1,11:00,11,Rafael Pereira dos Santos,Ituano,1301,21:41
728,140,19,774,2,14:00,59,Kaio Silva Mendes,Ituano,1364,22:44
729,140,19,775,2,37:00,82,Jorge Andres Roa Jimenez,Ituano,1387,23:07
730,141,9,776,2,01:00,46,Bryan Grabriel Fernandes,Crb,1351,22:31
731,141,9,777,2,24:00,69,Reginaldo Lopes de Jesus,Crb,1374,22:54
732,141,9,778,2,28:00,73,Emerson Ramon Bezerra Oliveira,Crb,1378,22:58
733,141,9,779,1,42:00,42,Marthã Fernando Goncalves Pimenta,Crb,1332,22:12
734,141,16,780,2,22:00,67,Rodrigo Vasconcelos Oliveira,Tombense,1372,22:52
735,141,16,781,1,35:00,35,Jose Ricardo Araujo Fernandes,Tombense,1325,22:05
736,141,16,782,1,48:00,48,David Junio Manoel dos Santos,Tombense,1338,22:18
737,141,16,783,2,51:00,96,Renato Ribeiro Calixto Aguiar,Tombense,1401,23:21
738,141,16,784,2,48:00,93,Italo Henrique dos Santos Soares,Tombense,1398,23:18
739,142,3,785,2,05:00,50,Lucas da Silva Xavier,Criciúma,1205,20:05
740,142,3,786,2,30:00,75,Arilson Carlos Alves Baptista,Criciúma,1230,20:30
741,142,11,787,1,12:00,12,Mateus Nascimento Soares,Náutico,1152,19:12
742,142,11,788,2,12:00,57,Richard Dario Franco Escobar,Náutico,1212,20:12
743,142,11,789,2,22:00,67,Wellington da Silva Pinto,Náutico,1222,20:22
744,142,11,790,2,31:00,76,Julio Rodrigues de Albuquerque,Náutico,1231,20:31
745,143,14,792,2,15:00,60,Rildo Goncalves de Amorim Filho,Bahia,1215,20:15
746,143,14,793,1,24:00,24,Ignacio da Silva Oliveira,Bahia,1164,19:24
747,143,14,794,2,35:00,80,Rai Nascimento de Oliveira,Bahia,1235,20:35
748,143,6,795,2,31:00,76,Gerson Rodolfo da Silva,Brusque,1231,20:31
749,143,6,796,2,31:00,76,Airton Santos de Oliveira,Brusque,1231,20:31
750,143,6,797,1,46:00,46,Jeferson Silva dos Santos,Brusque,1186,19:46
751,144,12,798,2,13:00,58,Anderson Luis de Carvalho,Vasco da Gama,1363,22:43
752,144,12,799,1,16:00,16,Juan Sebastian Quintero Fletcher,Vasco da Gama,1306,21:46
753,144,12,800,1,22:00,22,Andrey Nascimento dos Santos,Vasco da Gama,1312,21:52
754,144,12,801,1,24:00,24,Mauricio Ferreira de Souza,Vasco da Gama,1314,21:54
755,144,8,802,1,02:00,2,TGCarlos Eduardo Moreira,Novorizontino,1292,21:32
756,144,8,803,1,16:00,16,Ronaldo Henrique Silva,Novorizontino,1306,21:46
757,144,8,804,1,26:00,26,Jhony Douglas Santiago,Novorizontino,1316,21:56
758,144,8,805,1,36:00,36,Diego de Souza Quirino,Novorizontino,1326,22:06
759,145,18,807,2,10:00,55,Tiago Real do Prado,Chapecoense,1270,21:10
760,145,18,808,2,10:00,55,Marcelo de Freitas Costa,Chapecoense,1270,21:10
761,145,18,809,1,20:00,20,Chrystian Amaral Barletta de Almeida,Chapecoense,1220,20:20
762,145,18,810,2,42:00,87,Wesley Frazan Bernardo,Chapecoense,1302,21:42
763,145,17,811,1,17:00,17,Tomas Almino Bastos da Silva,Operário,1217,20:17
764,145,17,812,2,24:00,69,Giovanni Fernando Cofreste Pavani,Operário,1284,21:24
765,146,1,814,1,14:00,14,Gabriel Teixeira Aragao,Grêmio,1154,19:14
766,146,1,815,2,33:00,78,Gabriel Silva Azevedo Figueredo,Grêmio,1233,20:33
767,146,1,816,1,36:00,36,Mathias Adalberto Villasanti Rolon,Grêmio,1176,19:36
768,146,10,817,1,24:00,24,Elton Divino Celio,Londrina,1164,19:24
769,147,2,818,2,44:00,89,Wellington Ferreira Nascimento,Csa,1304,21:44
770,147,5,819,2,20:00,65,Rafael Oliveira Silva,Sampaio Corrêa,1280,21:20
771,148,4,820,1,16:00,16,Fabio Goncalves,Sport,1306,21:46
772,148,4,821,2,27:00,72,Sander Henrique Bortolotto,Sport,1377,22:57
773,148,15,822,2,08:00,53,Lucas da Cruz Oliveira,Cruzeiro Saf,1358,22:38
774,148,15,823,2,31:00,76,Jose Ivaldo Almeida Silva,Cruzeiro Saf,1381,23:01
775,149,0,824,2,08:00,53,Wallisson Luiz Alves Maximo,Ponte Preta,1358,22:38
776,149,0,825,2,22:00,67,Fabio Pizarro Sanches,Ponte Preta,1372,22:52
777,149,0,826,2,37:00,82,Felipe Amaral Casarin Damasceno,Ponte Preta,1387,23:07
778,149,13,827,2,07:00,52,Alex da Silva,Vila Nova,1357,22:37
779,149,13,828,2,24:00,69,Ralf de Souza Teles,Vila Nova,1374,22:54
780,150,0,829,2,01:00,46,Felipe Amaral Casarin Damasceno,Ponte Preta,721,12:01
781,150,0,830,1,29:00,29,Norberto Pereira Marinho Neto,Ponte Preta,689,11:29
782,150,16,831,1,24:00,24,Luis Otavio Bonilha de Oliveira,Tombense,684,11:24
783,150,16,832,1,31:00,31,David Junio Manoel dos Santos,Tombense,691,11:31
784,150,16,833,1,46:00,46,Jose Ricardo Araujo Fernandes,Tombense,706,11:46
785,150,16,834,2,48:00,93,Rodrigo Vasconcelos Oliveira,Tombense,768,12:48
786,151,7,835,1,34:00,34,Leandro Vilela Sales Teixeira,Guarani,1264,21:04
787,151,9,836,2,13:00,58,Reginaldo Lopes de Jesus,Crb,1303,21:43
788,151,9,837,2,21:00,66,Richard Alexandre Birkheun Rodrigues,Crb,1311,21:51
789,152,11,838,2,10:00,55,Djavan Aulim Candido de Souza,Náutico,1180,19:40
790,152,11,839,1,22:00,22,Geuvanio Santos da Silva Lima,Náutico,1132,18:52
791,152,8,840,2,21:00,66,Diego de Souza Quirino,Novorizontino,1191,19:51
792,152,8,841,1,22:00,22,Rodolfo Filemon de Oliveira da Silva,Novorizontino,1132,18:52
793,152,8,842,2,28:00,73,Romario Guilherme dos Santos,Novorizontino,1198,19:58
794,152,8,843,1,40:00,40,Bruno da Silva Costa,Novorizontino,1150,19:10
795,153,6,844,1,28:00,28,Wagner Pereira Marques,Brusque,1318,21:58
796,153,6,845,1,41:00,41,Marcos Rogerio Ricci Lopes,Brusque,1331,22:11
797,153,6,846,1,47:00,47,Gerson Rodolfo da Silva,Brusque,1337,22:17
798,154,3,847,2,02:00,47,Cristovam Roberto Ribeiro da Silva,Criciúma,1022,17:02
799,154,3,848,2,15:00,60,Rodrigo Fagundes de Freitas,Criciúma,1035,17:15
800,154,19,849,1,24:00,24,Caique de Jesus Goncalves,Ituano,984,16:24
801,154,19,850,2,34:00,79,Aylon Darwin Tavella,Ituano,1054,17:34
802,154,19,851,2,37:00,82,Bernardo Schappo,Ituano,1057,17:37
803,155,2,852,2,14:00,59,Geovane Silva Santos,Csa,734,12:14
804,155,2,853,2,37:00,82,Igor Inocencio de Oliveira,Csa,757,12:37
805,155,2,854,2,41:00,86,Alberto Valentim do Carmo Neto,Csa,761,12:41
806,155,10,855,2,17:00,62,Marcio Rodrigues Velasco,Londrina,737,12:17
807,156,4,856,1,24:00,24,Giovanni Piccolomo,Sport,984,16:24
808,156,4,857,2,41:00,86,Ray Andres Vanegas Zuniga,Sport,1061,17:41
809,156,12,858,2,31:00,76,Gabriel Fortes Chaves,Vasco da Gama,1051,17:31
810,156,12,859,2,36:00,81,Andrey Nascimento dos Santos,Vasco da Gama,1056,17:36
811,156,12,860,2,38:00,83,Edimar Curitiba Fraga,Vasco da Gama,1058,17:38
812,157,14,861,1,09:00,9,Rai Nascimento de Oliveira,Bahia,969,16:09
813,157,14,862,2,16:00,61,Matheus Bahia Santos,Bahia,1036,17:16
814,157,1,863,1,01:00,1,Pedro Tonon Geromel,Grêmio,961,16:01
815,157,1,864,2,05:00,50,Janderson Santos de Souza,Grêmio,1025,17:05
816,158,13,865,1,29:00,29,Pedro Gonzaga,Vila Nova,1319,21:59
817,158,13,866,1,37:00,37,Alisson Dias Tavares Cassiano,Vila Nova,1327,22:07
818,158,13,867,2,48:00,93,Rafael Ferreira Donato,Vila Nova,1398,23:18
819,158,15,868,1,39:00,39,Antonio Francisco Moura Neto,Cruzeiro Saf,1329,22:09
820,159,5,869,2,28:00,73,Rafael Oliveira Silva,Sampaio Corrêa,1228,20:28
821,159,5,870,2,43:00,88,Allan Godoi Santos,Sampaio Corrêa,1243,20:43
822,159,18,871,2,24:00,69,Matheus Henrique Bianqui,Chapecoense,1224,20:24
823,159,18,872,2,32:00,77,Tiago Real do Prado,Chapecoense,1232,20:32
824,160,7,873,2,52:00,97,Lucas Vinicius Goncalves Silva,Guarani,772,12:52
825,160,15,874,2,49:00,94,Lucas da Cruz Oliveira,Cruzeiro Saf,769,12:49
826,161,0,875,2,01:00,46,Thiago Oliveira Lopes,Ponte Preta,1201,20:01
827,161,0,876,2,47:00,92,Bernardo de Paulo Silva,Ponte Preta,1247,20:47
828,161,2,877,2,40:00,85,Diego Renan de Lima Ferreira,Csa,1240,20:40
829,162,4,879,2,10:00,55,Mailson Tenorio dos Santos,Sport,1030,17:10
830,162,4,880,2,12:00,57,Alan de Souza Guimaraes,Sport,1032,17:12
831,162,4,881,1,42:00,42,Luiz Carlos Cirne Lima de Lorenzi,Sport,1002,16:42
832,162,4,882,1,46:00,46,Ewerthon Diogenes da Silva,Sport,1006,16:46
833,162,4,883,2,47:00,92,Fabio Goncalves,Sport,1067,17:47
834,162,10,884,2,38:00,83,Samuel Henrique dos Santos Eleoterio,Londrina,1058,17:38
835,162,10,885,1,46:00,46,Douglas Coutinho Gomes de Souza,Londrina,1006,16:46
836,163,12,886,2,20:00,65,Thiago Rodrigues de Oliveira Nogueira,Vasco da Gama,1070,17:50
837,163,12,887,2,24:00,69,Getulio Wandelly Silva Timoteo,Vasco da Gama,1074,17:54
838,163,12,888,2,24:00,69,Leonardo de Matos Cruz,Vasco da Gama,1074,17:54
839,163,12,889,2,40:00,85,Andrey Nascimento dos Santos,Vasco da Gama,1090,18:10
840,163,12,890,1,48:00,48,Lucas Figueiredo dos Santos,Vasco da Gama,1038,17:18
841,163,3,891,1,47:00,47,Marcelo Hermes,Criciúma,1037,17:17
842,164,6,892,2,08:00,53,Jeferson Silva dos Santos,Brusque,1358,22:38
843,165,9,893,1,17:00,17,Diogo Jose Goncalves da Silva,Crb,1307,21:47
844,165,9,894,2,40:00,85,Gilvan Souza Correa,Crb,1390,23:10
845,165,17,895,1,17:00,17,Giovanni Fernando Cofreste Pavani,Operário,1307,21:47
846,165,17,896,2,17:00,62,Jose Brandao Goncalves Junior,Operário,1367,22:47
847,165,17,897,2,28:00,73,Giovani Albuquerque Felippi,Operário,1378,22:58
848,166,1,898,2,10:00,55,Nicolas Vichiatto da Silva,Grêmio,1360,22:40
849,166,11,899,2,09:00,54,Joao Lucas Cardoso,Náutico,1359,22:39
850,166,11,900,1,21:00,21,Luis Felipe Branco de Oliveira França,Náutico,1311,21:51
851,166,11,901,2,22:00,67,Thassio Marques Melo da Silva Almeida,Náutico,1372,22:52
852,166,11,902,1,23:00,23,Geuvanio Santos da Silva Lima,Náutico,1313,21:53
853,166,11,903,2,26:00,71,Richard Dario Franco Escobar,Náutico,1376,22:56
854,166,11,904,2,42:00,87,Jean Carlos Vicente,Náutico,1392,23:12
855,167,19,905,1,15:00,15,Aylon Darwin Tavella,Ituano,1125,18:45
856,167,19,906,2,25:00,70,Carlos Eduardo de Souza Vieira,Ituano,1195,19:55
857,168,18,907,1,30:00,30,Victor Ramos Ferreira,Chapecoense,1020,17:00
858,168,18,908,2,33:00,78,Luiz Henrique Mendes Silva da Costa,Chapecoense,1083,18:03
859,168,18,909,2,33:00,78,Leonardo Renan Simoes de Lacerda,Chapecoense,1083,18:03
860,168,16,910,2,36:00,81,Kleiton Pego Duarte,Tombense,1086,18:06
861,169,14,911,2,11:00,56,Rildo Goncalves de Amorim Filho,Bahia,1211,20:11
862,169,14,912,1,32:00,32,Andre Dhominique Queiroz Santiago da Silva,Bahia,1172,19:32
863,169,14,913,2,44:00,89,Matheus Bahia Santos,Bahia,1244,20:44
864,169,13,914,1,25:00,25,Daniel Amorim Dias da Silva,Vila Nova,1165,19:25
865,170,14,915,2,24:00,69,Djalma Antonio da Silva Filho,Bahia,1194,19:54
866,170,14,916,1,46:00,46,Lucas Andres Mugni,Bahia,1156,19:16
867,171,9,917,2,09:00,54,Fabio Augusto Luciano da Silva,Crb,1029,17:09
868,171,9,918,2,51:00,96,Wallace Madeira Almeida,Crb,1071,17:51
869,171,9,919,2,51:00,96,Gabriel da Conceição dos Santos,Crb,1071,17:51
870,171,6,920,2,06:00,51,Marcos Rogerio Ricci Lopes,Brusque,1026,17:06
871,172,18,921,2,30:00,75,Leonardo Renan Simoes de Lacerda,Chapecoense,1050,17:30
872,172,18,922,1,49:00,49,Roberto Pimenta Vinagre Filho,Chapecoense,1009,16:49
873,173,3,923,1,17:00,17,Cristovam Roberto Ribeiro da Silva,Criciúma,1157,19:17
874,173,3,924,1,20:00,20,Kadu Ribeiro Durval,Criciúma,1160,19:20
875,173,3,925,1,39:00,39,Marcos Gabriel do Nascimento,Criciúma,1179,19:39
876,173,3,926,1,49:00,49,Arilson Carlos Alves Baptista,Criciúma,1189,19:49
877,173,3,927,2,46:00,91,Lohan dos Santos Freire,Criciúma,1246,20:46
878,173,3,928,2,46:00,91,Romulo da Silva Machado,Criciúma,1246,20:46
879,173,0,929,1,10:00,10,Fabio Pizarro Sanches,Ponte Preta,1150,19:10
880,173,0,930,1,28:00,28,Douglas Mendes Moreira,Ponte Preta,1168,19:28
881,174,10,931,2,13:00,58,Joao Paulo da Silva,Londrina,733,12:13
882,174,10,932,2,32:00,77,Saimon Pains Tormen,Londrina,752,12:32
883,174,19,933,2,06:00,51,Bernardo Schappo,Ituano,726,12:06
884,174,19,934,1,45:00,45,Rafael Elias da Silva,Ituano,705,11:45
885,175,4,935,2,19:00,64,Paulo Cesar Fonseca Brandao,Sport,1189,19:49
886,175,17,936,2,05:00,50,Giovanni Fernando Cofreste Pavani,Operário,1175,19:35
887,175,17,937,2,13:00,58,Ricardo Ribeiro de Lima,Operário,1183,19:43
888,175,17,938,1,35:00,35,Jose Brandao Goncalves Junior,Operário,1145,19:05
889,176,1,939,1,29:00,29,Jaminton Leandro Campaz,Grêmio,1019,16:59
890,176,16,940,1,15:00,15,Paulo de Souza Junior,Tombense,1005,16:45
891,176,16,941,1,34:00,34,Roger de Carvalho,Tombense,1024,17:04
892,177,12,942,1,40:00,40,Anderson Conceição Benedito,Vasco da Gama,1030,17:10
893,177,12,943,2,45:00,90,Matheus Nunes Fagundes de Araujo,Vasco da Gama,1095,18:15
894,177,5,944,2,10:00,55,Rafael Oliveira Silva,Sampaio Corrêa,1060,17:40
895,177,5,945,1,50:00,50,Erinaldo Santos Rabelo,Sampaio Corrêa,1040,17:20
896,177,5,946,1,49:00,49,Nilson Barbosa Nascimento Junior,Sampaio Corrêa,1039,17:19
897,178,8,947,2,16:00,61,PFFabio Rogerio Jacobasso Silva,Novorizontino,1036,17:16
898,178,8,948,2,27:00,72,Daniel de Oliveira Sertanejo,Novorizontino,1047,17:27
899,178,8,949,1,43:00,43,Rafael Silva Guanaes,Novorizontino,1003,16:43
900,178,15,950,2,15:00,60,Jose Ivaldo Almeida Silva,Cruzeiro Saf,1035,17:15
901,178,15,951,2,36:00,81,Geovane de Jesus Rocha,Cruzeiro Saf,1056,17:36
902,178,15,952,1,41:00,41,Antonio Francisco Moura Neto,Cruzeiro Saf,1001,16:41
903,179,2,953,1,23:00,23,Wellington Ferreira Nascimento,Csa,1313,21:53
904,179,13,954,2,46:00,91,Moacir Costa da Silva,Vila Nova,1396,23:16
905,180,11,955,2,08:00,53,Geuvanio Santos da Silva Lima,Náutico,1208,20:08
906,180,11,956,1,29:00,29,Victor Ferraz Macedo,Náutico,1169,19:29
907,180,11,957,2,32:00,77,Nikolas Souza Trevizo,Náutico,1232,20:32
908,180,11,958,1,36:00,36,Ralph Machado Dias,Náutico,1176,19:36
909,180,11,959,2,41:00,86,Djavan Aulim Candido de Souza,Náutico,1241,20:41
910,180,0,960,2,09:00,54,Douglas Mendes Moreira,Ponte Preta,1209,20:09
911,180,0,961,1,29:00,29,Leonardo Naldi de Matos,Ponte Preta,1169,19:29
912,180,0,962,2,40:00,85,Eliel Chrystian Pereira Silva,Ponte Preta,1240,20:40
913,181,2,963,2,21:00,66,Lucas Barcelos Damacena,Csa,1221,20:21
914,181,2,964,1,27:00,27,Geovane Silva Santos,Csa,1167,19:27
915,181,2,965,1,44:00,44,Edson Lucas Pereira,Csa,1184,19:44
916,181,2,966,2,45:00,90,Gabriel Santana Pinto,Csa,1245,20:45
917,181,15,967,1,20:00,20,Luis Felipe Hungria Martins,Cruzeiro Saf,1160,19:20
918,181,15,968,1,34:00,34,Rafael Cabral Barbosa,Cruzeiro Saf,1174,19:34
919,181,15,969,1,44:00,44,Paulo Cesar Pezzolano Suarez,Cruzeiro Saf,1184,19:44
920,182,4,971,2,28:00,73,Ronaldo Henrique Ferreira da Silva,Sport,1288,21:28
921,182,4,972,1,45:00,45,Ezequiel Jacinto de Biasi,Sport,1245,20:45
922,182,13,973,2,01:00,46,Marcos Vinicius Alves Barreira,Vila Nova,1261,21:01
923,182,13,974,1,32:00,32,Pablo Dyego da Silva Rosa,Vila Nova,1232,20:32
924,182,13,975,2,32:00,77,Arthur Rodrigues Rezende,Vila Nova,1292,21:32
925,182,13,976,2,42:00,87,Rubens da Silva Coura,Vila Nova,1302,21:42
926,183,1,977,2,40:00,85,Pedro Lucas Tapias Obermuller,Grêmio,1240,20:40
927,183,6,978,1,22:00,22,Alvaro Rodrigues Vieira Junior,Brusque,1162,19:22
928,183,6,979,2,22:00,67,Fernando Jose Marques Maciel,Brusque,1222,20:22
929,184,17,980,2,25:00,70,Andre da Silva Lima,Operário,1375,22:55
930,184,17,981,2,49:00,94,Ronald Eugenio de Carvalho,Operário,1399,23:19
931,184,8,982,1,04:00,4,Ronaldo Henrique Silva,Novorizontino,1294,21:34
932,184,8,983,2,42:00,87,Cleone Santos Silva,Novorizontino,1392,23:12
933,184,8,984,1,43:00,43,Diego de Souza Quirino,Novorizontino,1333,22:13
934,184,8,985,2,48:00,93,Ligger Moreira Malaquias,Novorizontino,1398,23:18
935,185,5,986,2,21:00,66,Erinaldo Santos Rabelo,Sampaio Corrêa,1221,20:21
936,185,10,987,2,10:00,55,Jhonny Lucas Flora Barboza,Londrina,1210,20:10
937,185,10,988,2,33:00,78,Saimon Pains Tormen,Londrina,1233,20:33
938,186,12,989,2,05:00,50,Yuri Lima Lara,Vasco da Gama,1355,22:35
939,186,12,990,1,30:00,30,Juan Sebastian Quintero Fletcher,Vasco da Gama,1320,22:00
940,186,12,991,1,37:00,37,Anderson Conceição Benedito,Vasco da Gama,1327,22:07
941,186,19,992,2,18:00,63,Caique de Jesus Goncalves,Ituano,1368,22:48
942,186,19,993,2,30:00,75,Bruno Henrique Lopes,Ituano,1380,23:00
943,186,19,994,2,39:00,84,Kaio Silva Mendes,Ituano,1389,23:09
944,186,19,995,2,40:00,85,Filipe Alexandre da Costa,Ituano,1390,23:10
945,187,14,996,2,48:00,93,Ignacio da Silva Oliveira,Bahia,1248,20:48
946,187,9,997,1,38:00,38,Welington Pereira Rodrigues,Crb,1178,19:38
947,188,3,998,2,18:00,63,Jose Marcos Alves Luis,Criciúma,1218,20:18
948,188,16,999,2,18:00,63,Manoel Ferreira Lima Neto,Tombense,1218,20:18
949,188,16,1000,2,19:00,64,Paulo de Souza Junior,Tombense,1219,20:19
950,188,16,1001,2,37:00,82,Everton Galdino Moreira,Tombense,1237,20:37
951,189,7,1002,2,31:00,76,Derlan de Oliveira Bento,Guarani,1231,20:31
952,189,7,1003,2,44:00,89,Leandro Vilela Sales Teixeira,Guarani,1244,20:44
953,189,18,1004,2,22:00,67,Matheus Henrique Bianqui,Chapecoense,1222,20:22
954,189,18,1005,2,39:00,84,Leonardo Renan Simoes de Lacerda,Chapecoense,1239,20:39
955,190,7,1006,1,36:00,36,Derlan de Oliveira Bento,Guarani,696,11:36
956,190,7,1007,2,42:00,87,Lucas Vinicius Goncalves Silva,Guarani,762,12:42
957,190,6,1008,2,12:00,57,Edilson Jose da Silva Junior,Brusque,732,12:12
958,191,9,1009,1,26:00,26,Rafael Vinicius Carvalho Longuine,Crb,1256,20:56
959,191,9,1010,2,35:00,80,Diego Ivo Pires,Crb,1325,22:05
960,191,9,1011,1,38:00,38,Emerson Ramon Bezerra Oliveira,Crb,1268,21:08
961,191,9,1012,2,43:00,88,Yago Henrique Severino dos Santos,Crb,1333,22:13
962,191,8,1013,2,08:00,53,Felipe Albuquerque Felippi,Novorizontino,1298,21:38
963,191,8,1014,1,21:00,21,Leonardo Lima dos Santos,Novorizontino,1251,20:51
964,191,8,1015,1,24:00,24,MGAndre Baesso Rodrigues,Novorizontino,1254,20:54
965,191,8,1016,2,33:00,78,Vinicius Leite Silva,Novorizontino,1323,22:03
966,191,8,1017,2,40:00,85,Joilson de Jesus Demetrio Cardoso,Novorizontino,1330,22:10
967,192,11,1018,1,14:00,14,Wellington da Silva Pinto,Náutico,1124,18:44
968,192,10,1019,2,08:00,53,Jhonny Lucas Flora Barboza,Londrina,1178,19:38
969,192,10,1020,2,22:00,67,Alan Luciano Ruschel,Londrina,1192,19:52
970,192,10,1021,1,38:00,38,Augusto de Souza Silva,Londrina,1148,19:08
971,192,10,1022,2,42:00,87,Matheus Lucas Jacintho Ferreira,Londrina,1212,20:12
972,193,3,1023,1,13:00,13,Marcelo Hermes,Criciúma,1153,19:13
973,193,3,1024,1,19:00,19,Arilson Carlos Alves Baptista,Criciúma,1159,19:19
974,193,3,1025,2,41:00,86,Lohan dos Santos Freire,Criciúma,1241,20:41
975,193,2,1026,2,23:00,68,Felipe Augusto Ferreira Batista,Csa,1223,20:23
976,194,18,1028,2,10:00,55,Guilherme Natan de Lima,Chapecoense,1210,20:10
977,194,18,1029,1,14:00,14,Victor Ramos Ferreira,Chapecoense,1154,19:14
978,194,18,1030,1,22:00,22,Mailton dos Santos de Sa,Chapecoense,1162,19:22
979,194,18,1031,2,50:00,95,Ronei Gebing,Chapecoense,1250,20:50
980,194,19,1032,2,41:00,86,Roberto Heuchayer Santos de Araujo,Ituano,1241,20:41
981,194,19,1033,2,44:00,89,Lucas Vinicius Dias Costa,Ituano,1244,20:44
982,194,19,1034,1,51:00,51,Gabriel de Sousa Barros,Ituano,1191,19:51
983,195,17,1035,1,38:00,38,Ricardo Ribeiro de Lima,Operário,1178,19:38
984,195,16,1036,1,14:00,14,Everton Galdino Moreira,Tombense,1154,19:14
985,195,16,1037,1,24:00,24,Joseph Mauricio de Oliveira Figueiredo,Tombense,1164,19:24
986,196,1,1038,2,16:00,61,Aldemir dos Santos Ferreira,Grêmio,1066,17:46
987,196,1,1039,2,48:00,93,Bruno Fabiano Alves,Grêmio,1098,18:18
988,196,0,1040,2,09:00,54,Luis Otavio de Oliveira,Ponte Preta,1059,17:39
989,196,0,1041,2,26:00,71,Guilherme Macedo dos Anjos,Ponte Preta,1076,17:56
990,196,0,1042,1,33:00,33,Rondinelli da Silva Vieira,Ponte Preta,1023,17:03
991,196,0,1043,2,39:00,84,Wesley Fraga,Ponte Preta,1089,18:09
992,196,0,1044,2,43:00,88,Douglas Mendes Moreira,Ponte Preta,1093,18:13
993,197,5,1045,2,40:00,85,Rafael Oliveira Silva,Sampaio Corrêa,1390,23:10
994,198,14,1047,2,14:00,59,Lucas Andres Mugni,Bahia,1034,17:14
995,198,15,1048,2,09:00,54,Antonio Francisco Moura Neto,Cruzeiro Saf,1029,17:09
996,198,15,1049,1,14:00,14,Luvannor Henrique de Sousa Silva,Cruzeiro Saf,974,16:14
997,198,15,1050,2,21:00,66,Stenio Zanetti Toledo,Cruzeiro Saf,1041,17:21
998,198,15,1051,2,23:00,68,TGAndre Croda Borges,Cruzeiro Saf,1043,17:23
999,199,12,1053,1,37:00,37,Jose Gabriel dos Santos Silva,Vasco da Gama,1027,17:07
1000,199,13,1054,2,22:00,67,Antonio Eduardo Furquim de Freitas Batista,Vila Nova,1072,17:52
1001,199,13,1055,2,25:00,70,Marcos Vinicius Alves Barreira,Vila Nova,1075,17:55
1002,200,0,1056,2,02:00,47,Wesley Fraga,Ponte Preta,1202,20:02
1003,200,0,1057,1,14:00,14,Rondinelli da Silva Vieira,Ponte Preta,1154,19:14
1004,200,0,1058,1,26:00,26,Igor Marques Paciencia Cardoso,Ponte Preta,1166,19:26
1005,200,0,1059,1,41:00,41,Felipe Amaral Casarin Damasceno,Ponte Preta,1181,19:41
1006,200,17,1060,1,01:00,1,Simao Verza Bertelli,Operário,1141,19:01
1007,200,17,1061,2,33:00,78,Leandro Alves de Carvalho,Operário,1233,20:33
1008,200,17,1062,1,35:00,35,Lucas Pereira Mendes,Operário,1175,19:35
1009,200,17,1063,1,35:00,35,Paulo Sergio Luiz de Souza,Operário,1175,19:35
1010,200,17,1064,2,36:00,81,Renie Almeida da Silva,Operário,1236,20:36
1011,201,2,1065,2,17:00,62,Igor Inocencio de Oliveira,Csa,1307,21:47
1012,201,2,1066,1,29:00,29,Joao Paulo Ferreira Lourenco,Csa,1259,20:59
1013,201,2,1067,1,30:00,30,Alberto Valentim do Carmo Neto,Csa,1260,21:00
1014,201,2,1068,1,33:00,33,Hector Miguel Canteros,Csa,1263,21:03
1015,201,19,1069,2,33:00,78,Rafael Elias da Silva,Ituano,1323,22:03
1016,202,4,1071,1,21:00,21,Denner Fernando Melz,Sport,1311,21:51
1017,202,4,1072,2,27:00,72,Sander Henrique Bortolotto,Sport,1377,22:57
1018,202,4,1073,2,41:00,86,Giovanni Piccolomo,Sport,1391,23:11
1019,202,7,1074,1,04:00,4,Jamerson Santos de Jesus,Guarani,1294,21:34
1020,202,7,1075,1,37:00,37,Jose Rodrigo Andrade Ramos,Guarani,1327,22:07
1021,203,6,1076,1,34:00,34,Alex Ruan Vasconcelos Ferreira,Brusque,694,11:34
1022,203,6,1077,2,49:00,94,Gabriel Pereira Taliari,Brusque,769,12:49
1023,203,6,1078,2,52:00,97,Gerson Rodolfo da Silva,Brusque,772,12:52
1024,203,6,1079,2,45:00,90,Edilson Jose da Silva Junior,Brusque,765,12:45
1025,203,15,1080,1,20:00,20,Geovane de Jesus Rocha,Cruzeiro Saf,680,11:20
1026,203,15,1081,1,30:00,30,Jose Ivaldo Almeida Silva,Cruzeiro Saf,690,11:30
1027,204,13,1082,2,05:00,50,Altemir Cordeiro Pessôa Neto,Vila Nova,1175,19:35
1028,204,13,1083,2,10:00,55,Alex da Silva,Vila Nova,1180,19:40
1029,204,13,1084,1,11:00,11,Willian Prado Camargo,Vila Nova,1121,18:41
1030,204,13,1085,2,24:00,69,Arthur Rodrigues Rezende,Vila Nova,1194,19:54
1031,204,13,1086,2,50:00,95,Diego Barbosa Tavares,Vila Nova,1220,20:20
1032,204,8,1087,2,03:00,48,Daniel de Oliveira Sertanejo,Novorizontino,1173,19:33
1033,204,8,1088,1,21:00,21,Jose Walber Mota de Amorim,Novorizontino,1131,18:51
1034,204,8,1089,2,30:00,75,TGCarlos Eduardo Moreira,Novorizontino,1200,20:00
1035,205,3,1091,2,03:00,48,Gustavo Cazonatti,Criciúma,1023,17:03
1036,205,3,1092,2,05:00,50,Helder Silva Santos,Criciúma,1025,17:05
1037,205,3,1093,1,12:00,12,Cristovam Roberto Ribeiro da Silva,Criciúma,972,16:12
1038,205,10,1094,2,13:00,58,Saimon Pains Tormen,Londrina,1033,17:13
1039,205,10,1095,1,32:00,32,Denilson dos Santos de Souza,Londrina,992,16:32
1040,205,10,1096,2,36:00,81,Jhonny Lucas Flora Barboza,Londrina,1056,17:36
1041,206,12,1097,2,43:00,88,Carlosalonso Enrique Palacios Nunez,Vasco da Gama,1243,20:43
1042,206,9,1098,2,10:00,55,Reginaldo Lopes de Jesus,Crb,1210,20:10
1043,206,9,1099,1,23:00,23,Daniel Pollo Barion,Crb,1163,19:23
1044,206,9,1100,1,37:00,37,Yago Henrique Severino dos Santos,Crb,1177,19:37
1045,206,9,1101,1,46:00,46,Gilvan Souza Correa,Crb,1186,19:46
1046,207,14,1102,2,30:00,75,Matheus Alvarenga de Oliveira,Bahia,1230,20:30
1047,207,14,1103,2,38:00,83,Everton Macedo Moraes,Bahia,1238,20:38
1048,207,11,1104,2,32:00,77,Jean Carlos Vicente,Náutico,1232,20:32
1049,208,5,1105,2,46:00,91,Andrey Nunes dos Santos,Sampaio Corrêa,1396,23:16
1050,208,16,1106,2,21:00,66,Diego Ferreira Matheus,Tombense,1371,22:51
1051,209,1,1107,2,03:00,48,Lucas Pezzini Leiva,Grêmio,1173,19:33
1052,209,1,1108,2,13:00,58,Nicolas Vichiatto da Silva,Grêmio,1183,19:43
1053,209,1,1109,1,46:00,46,Roger Machado Marques,Grêmio,1156,19:16
1054,210,1,1111,2,06:00,51,Roberto Lampert Ribas,Grêmio,1356,22:36
1055,210,7,1112,1,06:00,6,Eduardo Luiz Person,Guarani,1296,21:36
1056,210,7,1113,2,13:00,58,Diogo Mateus de Almeida Rodrigues Maciel,Guarani,1363,22:43
1057,210,7,1114,2,36:00,81,Julio Cesar Czarneski,Guarani,1386,23:06
1058,211,9,1115,2,07:00,52,Wellington Carvalho dos Santos,Crb,1357,22:37
1059,211,9,1116,2,41:00,86,MDElio Goncalves Melo Junior,Crb,1391,23:11
1060,211,0,1117,2,02:00,47,Fabio Pizarro Sanches,Ponte Preta,1352,22:32
1061,211,0,1118,1,10:00,10,Mateus Ferreira da Silva,Ponte Preta,1300,21:40
1062,212,4,1120,2,47:00,92,Lucas Camilo Hernández Perdomo,Sport,1397,23:17
1063,212,3,1121,1,36:00,36,Oswaldo Jose Henriquez Bocanegra,Criciúma,1326,22:06
1064,212,3,1122,1,44:00,44,Leonardo de Oliveira Costa,Criciúma,1334,22:14
1065,212,3,1123,2,48:00,93,Claudio Aparecido Tencati,Criciúma,1398,23:18
1066,212,3,1124,2,49:00,94,Marcos Vinicius Cerato,Criciúma,1399,23:19
1067,212,3,1125,2,50:00,95,Caio Henrique da Silva Dantas,Criciúma,1400,23:20
1068,213,5,1126,1,36:00,36,Leandro Ferreira Pessoa,Sampaio Corrêa,1176,19:36
1069,213,5,1127,2,40:00,85,Eloir Silva Moreira,Sampaio Corrêa,1240,20:40
1070,213,5,1128,2,44:00,89,Lucas Araujo de Oliveira,Sampaio Corrêa,1244,20:44
1071,213,6,1129,2,15:00,60,Fernando Jose Marques Maciel,Brusque,1215,20:15
1072,213,6,1130,1,17:00,17,Wagner Pereira Marques,Brusque,1157,19:17
1073,213,6,1131,2,19:00,64,Gerson Rodolfo da Silva,Brusque,1219,20:19
1074,213,6,1132,2,44:00,89,Gabriel Pereira Taliari,Brusque,1244,20:44
1075,214,10,1134,2,48:00,93,Jeferson de Araujo de Carvalho,Londrina,1248,20:48
1076,214,10,1135,2,45:00,90,Alan Luciano Ruschel,Londrina,1245,20:45
1077,214,8,1136,2,04:00,49,Ronaldo Henrique Silva,Novorizontino,1204,20:04
1078,214,8,1137,2,20:00,65,Joao Pedro de Giuli,Novorizontino,1220,20:20
1079,214,8,1138,2,29:00,74,Daniel de Oliveira Sertanejo,Novorizontino,1229,20:29
1080,215,11,1139,2,02:00,47,Jean Carlos Vicente,Náutico,1202,20:02
1081,215,17,1140,2,01:00,46,Thales Natanael Lira de Matos,Operário,1201,20:01
1082,215,17,1141,1,04:00,4,Arnaldo Manoel de Almeida,Operário,1144,19:04
