id,partidaId,timeId,jogadorId,tempo,minuto,minutoGeral,jogador,time,horarioInt,horarioString
1432,291,15,1517,1,15:00,15,Stenio Zanetti Toledo,Cruzeiro Saf,1245,20:45
1433,292,14,1518,1,35:00,35,Daniel Sampaio Simoes,Bahia,1235,20:35
1434,292,14,1519,1,36:00,36,Igor Torres da Silva,Bahia,1236,20:36
1435,292,4,1520,2,22:00,67,Wanderson Cristaldo Farias,Sport,1282,21:22
1436,293,13,1521,2,31:00,76,Matheus Mancini,Vila Nova,1081,18:01
1437,293,13,1522,2,40:00,85,Riquelme Sousa Silva,Vila Nova,1090,18:10
1438,293,13,1523,2,48:00,93,Hugo da Silva Cabral,Vila Nova,1098,18:18
1439,293,6,1524,1,05:00,5,Edilson Jose da Silva Junior,Brusque,995,16:35
1440,293,6,1525,1,05:00,5,Bruno Henrique Fortunato Aguiar,Brusque,995,16:35
1441,293,6,1526,2,13:00,58,Wallace Reis Silva,Brusque,1063,17:43
1442,293,6,1527,1,45:00,45,Gilson Kleina,Brusque,1035,17:15
1443,294,1,1528,1,26:00,26,Lucas Pezzini Leiva,Grêmio,1316,21:56
1444,294,1,1529,2,28:00,73,Thaciano Mickael da Silva,Grêmio,1378,22:58
1445,294,1,1530,1,34:00,34,Edilson Mendes Guimaraes,Grêmio,1324,22:04
1446,294,8,1531,1,18:00,18,Gustavo Costa da Silva Machado,Novorizontino,1308,21:48
1447,294,8,1532,1,40:00,40,Lucas Costa da Silva,Novorizontino,1330,22:10
1448,294,8,1533,1,44:00,44,Bruno da Silva Costa,Novorizontino,1334,22:14
1449,295,7,1534,2,27:00,72,Jose Rodrigo Andrade Ramos,Guarani,1227,20:27
1450,295,7,1535,1,36:00,36,Leandro Vilela Sales Teixeira,Guarani,1176,19:36
1451,295,7,1536,2,36:00,81,Jamerson Santos de Jesus,Guarani,1236,20:36
1452,295,7,1537,2,50:00,95,Giovanni Augusto Oliveira Cardoso,Guarani,1250,20:50
1453,295,17,1538,1,22:00,22,Renie Almeida da Silva,Operário,1162,19:22
1454,295,17,1539,2,50:00,95,Leandro Alves de Carvalho,Operário,1250,20:50
1455,295,17,1540,1,45:00,45,TGDouglas Luisi Dutra,Operário,1185,19:45
1456,296,11,1542,1,32:00,32,Mauricio dos Santos Nascimento,Náutico,1172,19:32
1457,296,11,1543,1,32:00,32,Jean de Melo Pereira,Náutico,1172,19:32
1458,296,11,1544,2,46:00,91,Victor Ferraz Macedo,Náutico,1246,20:46
1459,296,22,1545,2,19:00,64,Danilo Boza Junior,Vasco da Gama S.a.f.,1219,20:19
1460,296,22,1546,2,29:00,74,Leonardo de Matos Cruz,Vasco da Gama S.a.f.,1229,20:29
1461,296,22,1547,1,32:00,32,Thiago Rodrigues de Oliveira Nogueira,Vasco da Gama S.a.f.,1172,19:32
1462,296,22,1548,2,35:00,80,Eguinaldo de Sousa Lemos,Vasco da Gama S.a.f.,1235,20:35
1463,297,3,1549,2,41:00,86,Helder Silva Santos,Criciúma,1241,20:41
1464,297,3,1550,1,43:00,43,Arilson Carlos Alves Baptista,Criciúma,1183,19:43
1465,297,5,1551,1,43:00,43,Mateus da Silva Duarte,Sampaio Corrêa,1183,19:43
1466,298,10,1552,2,29:00,74,Leandro Henrique do Nascimento,Londrina,1379,22:59
1467,298,10,1553,2,42:00,87,Alan Luciano Ruschel,Londrina,1392,23:12
1468,298,16,1554,2,24:00,69,Jociel Ferreira da Silva,Tombense,1374,22:54
1469,298,16,1555,2,45:00,90,Bruno Marques Fernandes Pivetti,Tombense,1395,23:15
1470,298,16,1556,2,45:00,90,Ricardo Lourenco Pagani,Tombense,1395,23:15
1471,300,7,1560,1,04:00,4,Ronaldo Luiz Alves,Guarani,1294,21:34
1472,300,7,1561,2,38:00,83,Jose Rodrigo Andrade Ramos,Guarani,1388,23:08
1473,300,8,1562,1,18:00,18,Leonardo Lima dos Santos,Novorizontino,1308,21:48
1474,300,8,1563,2,34:00,79,Jhony Douglas Santiago,Novorizontino,1384,23:04
1475,300,8,1564,2,47:00,92,Diego de Souza Quirino,Novorizontino,1397,23:17
1476,301,2,1565,2,17:00,62,Lucas Alexandre Marques Otaviano,Csa,1277,21:17
1477,301,16,1566,2,40:00,85,Joseph Mauricio de Oliveira Figueiredo,Tombense,1300,21:40
1478,302,11,1567,1,08:00,8,Arthur Henrique Vieira Araujo,Náutico,1148,19:08
1479,302,11,1568,2,34:00,79,Jobson Souza Santos,Náutico,1234,20:34
1480,302,11,1569,2,40:00,85,Joao Paulo Silveira dos Santos,Náutico,1240,20:40
1481,302,11,1570,1,42:00,42,Joao Lucas Cardoso,Náutico,1182,19:42
1482,302,5,1571,1,22:00,22,Paulo Sergio Marques Correa,Sampaio Corrêa,1162,19:22
1483,302,5,1572,2,49:00,94,Nadson da Silva Mesquita,Sampaio Corrêa,1249,20:49
1484,303,3,1573,2,21:00,66,Marcos Vinicius Cerato,Criciúma,1191,19:51
1485,303,3,1574,1,46:00,46,Rodrigo Fagundes de Freitas,Criciúma,1156,19:16
1486,303,18,1575,2,36:00,81,Victor Ramos Ferreira,Chapecoense,1206,20:06
1487,304,6,1576,1,22:00,22,Carlos Fabiano Mazolla Vieira,Brusque,682,11:22
1488,304,6,1577,2,26:00,71,Crislan Henrique da Silva de Sousa,Brusque,746,12:26
1489,304,6,1578,2,46:00,91,Alex Ruan Vasconcelos Ferreira,Brusque,766,12:46
1490,304,19,1579,1,33:00,33,Carlos Roberto da Cruz Junior,Ituano,693,11:33
1491,305,0,1580,1,11:00,11,Artur Sergio Batista de Souza,Ponte Preta,1301,21:41
1492,305,0,1581,1,21:00,21,Mateus Ferreira da Silva,Ponte Preta,1311,21:51
1493,305,0,1582,2,49:00,94,Lucas Ribamar Lopes dos Santos Bibiano,Ponte Preta,1399,23:19
1494,305,10,1583,1,40:00,40,Douglas Coutinho Gomes de Souza,Londrina,1330,22:10
1495,305,10,1584,2,46:00,91,Gustavo Vilar dos Santos,Londrina,1396,23:16
1496,306,4,1586,1,41:00,41,Sander Henrique Bortolotto,Sport,1181,19:41
1497,306,1,1587,2,17:00,62,Edilson Mendes Guimaraes,Grêmio,1217,20:17
1498,306,1,1588,2,20:00,65,Lucas Pezzini Leiva,Grêmio,1220,20:20
1499,306,1,1589,1,36:00,36,Thiago dos Santos,Grêmio,1176,19:36
1500,306,1,1590,2,41:00,86,Diogo Barbosa Mendanha,Grêmio,1241,20:41
1501,306,1,1591,2,47:00,92,Bruno Fabiano Alves,Grêmio,1247,20:47
1502,307,17,1592,1,31:00,31,Paulo Victor Ferreira de Jesus,Operário,1126,18:46
1503,308,15,1594,2,30:00,75,Kaiki Bruno da Silva,Cruzeiro Saf,1350,22:30
1504,308,15,1595,1,45:00,45,Stenio Zanetti Toledo,Cruzeiro Saf,1305,21:45
1505,308,22,1596,1,36:00,36,Paulo Victor de Almeida Barbosa,Vasco da Gama S.a.f.,1296,21:36
1506,308,22,1597,2,44:00,89,Yuri Lima Lara,Vasco da Gama S.a.f.,1364,22:44
1507,309,9,1598,1,09:00,9,Claudinei Junio de Souza,Crb,1299,21:39
1508,309,9,1599,2,32:00,77,Paulo Roberto Valoura Junior,Crb,1382,23:02
1509,309,9,1600,2,37:00,82,Daniel dos Santos Cerqueira,Crb,1387,23:07
1510,309,13,1601,2,14:00,59,Wagner Ferreira dos Santos,Vila Nova,1364,22:44
1511,309,13,1602,2,37:00,82,Lucas Baptista Felix,Vila Nova,1387,23:07
1512,310,0,1604,2,06:00,51,Wallisson Luiz Alves Maximo,Ponte Preta,1206,20:06
1513,310,0,1605,2,16:00,61,Fabio Pizarro Sanches,Ponte Preta,1216,20:16
1514,310,0,1606,2,39:00,84,Elvis Vieira Araujo,Ponte Preta,1239,20:39
1515,310,0,1607,2,42:00,87,Artur Sergio Batista de Souza,Ponte Preta,1242,20:42
1516,310,15,1608,2,23:00,68,Eduardo Nascimento da Silva Junior,Cruzeiro Saf,1223,20:23
1517,310,15,1609,1,35:00,35,Leonardo Javier Pais Corbo,Cruzeiro Saf,1175,19:35
1518,311,7,1610,1,27:00,27,Leandro Vilela Sales Teixeira,Guarani,1167,19:27
1519,311,2,1611,2,04:00,49,Yann Del Pino Rolim,Csa,1204,20:04
1520,311,2,1612,2,09:00,54,Osvaldo Lourenco Filho,Csa,1209,20:09
1521,312,4,1613,1,49:00,49,Facundo Labandeira Castro,Sport,1354,22:34
1522,312,11,1614,1,08:00,8,Jean Carlos Vicente,Náutico,1313,21:53
1523,312,11,1615,2,10:00,55,Richard Dario Franco Escobar,Náutico,1375,22:55
1524,313,3,1616,2,16:00,61,Lohan dos Santos Freire,Criciúma,736,12:16
1525,313,6,1617,2,23:00,68,Luiz Antonio de Souza Soares,Brusque,743,12:23
1526,313,6,1618,2,30:00,75,Fernando Jose Marques Maciel,Brusque,750,12:30
1527,314,9,1619,2,41:00,86,Marthã Fernando Goncalves Pimenta,Crb,1211,20:11
1528,314,19,1620,1,03:00,3,Lucas Nathan Veloso,Ituano,1113,18:33
1529,315,13,1621,2,41:00,86,Van Basty Sousa E Silva,Vila Nova,1241,20:41
1530,315,17,1622,2,34:00,79,Fernando Jose da Cunha Neto,Operário,1234,20:34
1531,315,17,1623,2,40:00,85,Simao Verza Bertelli,Operário,1240,20:40
1532,316,10,1624,1,08:00,8,Jeferson de Araujo de Carvalho,Londrina,1298,21:38
1533,316,10,1625,2,29:00,74,Luiz Gustavo da Silva Machado Duarte,Londrina,1379,22:59
1534,316,22,1626,1,25:00,25,Eguinaldo de Sousa Lemos,Vasco da Gama S.a.f.,1315,21:55
1535,316,22,1627,2,29:00,74,Yuri Lima Lara,Vasco da Gama S.a.f.,1379,22:59
1536,317,1,1628,2,07:00,52,Guilherme Augusto Vieira dos Santos,Grêmio,1207,20:07
1537,317,1,1629,2,12:00,57,Walter Kannemann,Grêmio,1212,20:12
1538,317,1,1630,2,49:00,94,Gabriel Teixeira Aragao,Grêmio,1249,20:49
1539,317,5,1631,1,49:00,49,André Luiz Guimarães Siqueira Junior,Sampaio Corrêa,1189,19:49
1540,318,8,1632,1,18:00,18,Jhony Douglas Santiago,Novorizontino,1158,19:18
1541,318,8,1633,2,39:00,84,Vinicius Augusto Ribeiro de Almeida,Novorizontino,1239,20:39
1542,318,16,1634,1,18:00,18,Rafael de Carvalho Santos,Tombense,1158,19:18
1543,318,16,1635,2,38:00,83,Felipe Garcia dos Prazeres,Tombense,1238,20:38
1544,319,14,1636,2,21:00,66,Luiz Henrique dos Santos Junior,Bahia,1371,22:51
1545,319,14,1637,2,35:00,80,Marcio Almeida de Oliveira,Bahia,1385,23:05
1546,319,18,1638,1,24:00,24,Gildson Pablo de Oliveira Silva,Chapecoense,1314,21:54
1547,319,18,1639,2,25:00,70,Willian Popp,Chapecoense,1375,22:55
1548,319,18,1640,1,33:00,33,Chrystian Amaral Barletta de Almeida,Chapecoense,1323,22:03
1549,319,18,1641,2,37:00,82,Pedro Henrique Perotti,Chapecoense,1387,23:07
1550,319,18,1642,2,48:00,93,Victor Ramos Ferreira,Chapecoense,1398,23:18
1551,319,18,1643,2,48:00,93,Mailton dos Santos de Sa,Chapecoense,1398,23:18
1552,320,7,1645,1,18:00,18,João Victor Carroll Santana,Guarani,1218,20:18
1553,320,10,1646,1,12:00,12,Mauricio Caprini Pinto,Londrina,1212,20:12
1554,320,10,1647,2,35:00,80,Denilson dos Santos de Souza,Londrina,1295,21:35
1555,320,10,1648,2,39:00,84,Matheus Lucas Jacintho Ferreira,Londrina,1299,21:39
1556,321,9,1651,2,16:00,61,Guilherme Kennedy Romao,Crb,1216,20:16
1557,321,9,1652,1,21:00,21,Gilvan Souza Correa,Crb,1161,19:21
1558,321,9,1653,2,24:00,69,Paulo Roberto Moccelin,Crb,1224,20:24
1559,321,9,1654,1,31:00,31,Fabio Augusto Luciano da Silva,Crb,1171,19:31
1560,321,9,1655,1,49:00,49,Marthã Fernando Goncalves Pimenta,Crb,1189,19:49
1561,321,9,1656,2,52:00,97,Uillian Correia Granemann,Crb,1252,20:52
1562,321,9,1657,2,45:00,90,Anselmo Ramon Alves Herculano,Crb,1245,20:45
1563,321,18,1658,1,12:00,12,Marcelo de Freitas Costa,Chapecoense,1152,19:12
1564,321,18,1659,2,33:00,78,Matheus Henrique Bianqui,Chapecoense,1233,20:33
1565,321,18,1660,2,52:00,97,Saulo Squarsone Rodrigues dos Santos,Chapecoense,1252,20:52
1566,322,11,1661,2,13:00,58,Jean Carlos Vicente,Náutico,1363,22:43
1567,322,11,1662,2,22:00,67,Elierce Barboza de Souza,Náutico,1372,22:52
1568,322,11,1663,2,27:00,72,Joao Paulo Silveira dos Santos,Náutico,1377,22:57
1569,322,11,1664,1,47:00,47,Julio Rodrigues de Albuquerque,Náutico,1337,22:17
1570,322,11,1665,2,48:00,93,Joao Lucas Cardoso,Náutico,1398,23:18
1571,322,16,1666,2,13:00,58,Paulo de Souza Junior,Tombense,1363,22:43
1572,322,16,1667,1,46:00,46,Guilherme Ribeiro Rend,Tombense,1336,22:16
1573,323,4,1668,2,23:00,68,Jose Sabino Chagas Monteiro,Sport,1223,20:23
1574,323,4,1669,1,34:00,34,Gustavo Coutinho Silva Lopes,Sport,1174,19:34
1575,323,4,1670,1,36:00,36,Ronaldo Henrique Ferreira da Silva,Sport,1176,19:36
1576,324,14,1673,2,13:00,58,Lucas Andres Mugni,Bahia,1363,22:43
1577,324,14,1674,2,37:00,82,Emerson Gustavo Pinto dos Santos,Bahia,1387,23:07
1578,324,8,1675,1,07:00,7,Diego Fabian Torres,Novorizontino,1297,21:37
1579,324,8,1676,2,22:00,67,Ramon Martinez Lopez,Novorizontino,1372,22:52
1580,324,8,1677,1,31:00,31,MGAndre Baesso Rodrigues,Novorizontino,1321,22:01
1581,324,8,1678,1,31:00,31,Gustavo Costa da Silva Machado,Novorizontino,1321,22:01
1582,325,17,1680,2,36:00,81,Simao Verza Bertelli,Operário,1236,20:36
1583,325,22,1681,2,10:00,55,Alex Teixeira Santos,Vasco da Gama S.a.f.,1210,20:10
1584,325,22,1682,2,11:00,56,Leonardo de Matos Cruz,Vasco da Gama S.a.f.,1211,20:11
1585,325,22,1683,2,25:00,70,Bruno Nunes de Barros,Vasco da Gama S.a.f.,1225,20:25
1586,326,1,1684,2,10:00,55,Elkeson de Oliveira Cardoso,Grêmio,1210,20:10
1587,326,2,1685,1,15:00,15,Rickson Barbosa Sa da Conceicao,Csa,1155,19:15
1588,326,2,1686,2,21:00,66,Felipe Augusto Ferreira Batista,Csa,1221,20:21
1589,326,2,1687,1,31:00,31,Matheus Ferreira de Sousa,Csa,1171,19:31
1590,327,0,1688,1,08:00,8,Lucas Ribamar Lopes dos Santos Bibiano,Ponte Preta,1208,20:08
1591,328,19,1689,1,44:00,44,Caique de Jesus Goncalves,Ituano,1334,22:14
1592,328,15,1690,1,15:00,15,Bruno Rafael Rodrigues do Nascimento,Cruzeiro Saf,1305,21:45
1593,328,15,1691,2,40:00,85,Luiz Filipe da Rosa Machado,Cruzeiro Saf,1390,23:10
1594,329,3,1693,1,28:00,28,Hygor Cleber Garcia Silva,Criciúma,1168,19:28
1595,329,3,1694,2,40:00,85,Marcos Vinicius Cerato,Criciúma,1240,20:40
1596,329,13,1695,2,53:00,98,Kaio Nunes Ferreira,Vila Nova,1253,20:53
1597,330,0,1696,2,03:00,48,Wallisson Luiz Alves Maximo,Ponte Preta,1203,20:03
1598,330,0,1697,2,16:00,61,Mateus Ferreira da Silva,Ponte Preta,1216,20:16
1599,330,0,1698,2,20:00,65,Felipe Amaral Casarin Damasceno,Ponte Preta,1220,20:20
1600,330,0,1699,1,23:00,23,Fabio Pizarro Sanches,Ponte Preta,1163,19:23
1601,330,0,1700,1,29:00,29,Igor Marques Paciencia Cardoso,Ponte Preta,1169,19:29
1602,330,0,1701,1,41:00,41,Caique Franca Godoy,Ponte Preta,1181,19:41
1603,330,13,1702,2,09:00,54,Willian Prado Camargo,Vila Nova,1209,20:09
1604,330,13,1703,2,19:00,64,Rafael Ferreira Donato,Vila Nova,1219,20:19
1605,330,13,1704,1,31:00,31,Arthur Rodrigues Rezende,Vila Nova,1171,19:31
1606,330,13,1705,1,35:00,35,Kaio Nunes Ferreira,Vila Nova,1175,19:35
1607,331,2,1706,1,20:00,20,Guilherme Mendes da Silva,Csa,1310,21:50
1608,331,2,1707,2,27:00,72,Lucas Alexandre Marques Otaviano,Csa,1377,22:57
1609,331,2,1708,1,30:00,30,Gabriel Santana Pinto,Csa,1320,22:00
1610,331,2,1709,2,45:00,90,Geovane Batista de Faria,Csa,1395,23:15
1611,331,5,1710,1,03:00,3,Mateus da Silva Duarte,Sampaio Corrêa,1293,21:33
1612,331,5,1711,1,26:00,26,Anderson Wanderllan de Moraes Rodrigues,Sampaio Corrêa,1316,21:56
1613,331,5,1712,1,33:00,33,Lucas Hipolito Cavalcante E Silva,Sampaio Corrêa,1323,22:03
1614,331,5,1713,2,34:00,79,Leonardo Santiago Barcelar,Sampaio Corrêa,1384,23:04
1615,331,5,1714,2,48:00,93,André Luiz Guimarães Siqueira Junior,Sampaio Corrêa,1398,23:18
1616,332,4,1715,2,12:00,57,Lucas Camilo Hernández Perdomo,Sport,1032,17:12
1617,332,15,1716,2,46:00,91,Lucas da Cruz Oliveira,Cruzeiro Saf,1066,17:46
1618,333,11,1717,2,17:00,62,Anilson Dourado Santiago,Náutico,1217,20:17
1619,333,11,1718,2,25:00,70,Jobson Souza Santos,Náutico,1225,20:25
1620,333,11,1719,2,42:00,87,Ralph Machado Dias,Náutico,1242,20:42
1621,334,7,1721,2,35:00,80,Diogo Mateus de Almeida Rodrigues Maciel,Guarani,1205,20:05
1622,334,19,1722,2,07:00,52,Kaio Silva Mendes,Ituano,1177,19:37
1623,334,19,1723,2,13:00,58,Gabriel de Sousa Barros,Ituano,1183,19:43
1624,335,1,1724,1,17:00,17,Edilson Mendes Guimaraes,Grêmio,1007,16:47
1625,335,1,1725,1,20:00,20,Walter Kannemann,Grêmio,1010,16:50
1626,335,1,1726,2,38:00,83,Mathias Adalberto Villasanti Rolon,Grêmio,1088,18:08
1627,335,10,1727,1,28:00,28,Luiz Gustavo da Silva Machado Duarte,Londrina,1018,16:58
1628,335,10,1728,2,32:00,77,Pedro Augusto Cacho Alves da Silva,Londrina,1082,18:02
1629,335,10,1729,1,34:00,34,Gabriel dos Santos Francisco,Londrina,1024,17:04
1630,335,10,1730,2,48:00,93,Luiz Carlos Paulino de Carvalho,Londrina,1098,18:18
1631,336,8,1731,2,07:00,52,Gustavo Costa da Silva Machado,Novorizontino,1177,19:37
1632,336,8,1732,1,39:00,39,Willean Bernardo Willemen,Novorizontino,1149,19:09
1633,336,8,1733,1,47:00,47,Ligger Moreira Malaquias,Novorizontino,1157,19:17
1634,336,22,1734,2,02:00,47,Leonardo de Matos Cruz,Vasco da Gama S.a.f.,1172,19:32
1635,336,22,1735,1,33:00,33,Edimar Curitiba Fraga,Vasco da Gama S.a.f.,1143,19:03
1636,336,22,1736,2,45:00,90,Bruno Nunes de Barros,Vasco da Gama S.a.f.,1215,20:15
1637,337,14,1737,2,05:00,50,Patrick de Lucca Chaves de Oliveira,Bahia,1025,17:05
1638,337,14,1738,2,12:00,57,Daniel Sampaio Simoes,Bahia,1032,17:12
1639,337,6,1739,1,39:00,39,Wallace Reis Silva,Brusque,999,16:39
1640,338,9,1740,2,06:00,51,Paulo Roberto Valoura Junior,Crb,1176,19:36
1641,339,18,1741,2,14:00,59,Thomas Jaguaribe Bedinelli,Chapecoense,734,12:14
1642,339,18,1742,1,44:00,44,Gildson Pablo de Oliveira Silva,Chapecoense,704,11:44
1643,339,18,1743,2,52:00,97,Wesley Frazan Bernardo,Chapecoense,772,12:52
1644,339,18,1744,2,52:00,97,Victor Ramos Ferreira,Chapecoense,772,12:52
1645,339,17,1745,2,14:00,59,Felipe Garcia Goncalves,Operário,734,12:14
1646,339,17,1746,2,15:00,60,Ricardo Ribeiro de Lima,Operário,735,12:15
1647,339,17,1747,1,24:00,24,Vanderlei Farias da Silva,Operário,684,11:24
1648,340,7,1750,1,28:00,28,Yuri Jonathan Vitor Coelho,Guarani,1168,19:28
1649,340,7,1751,2,38:00,83,Jamerson Santos de Jesus,Guarani,1238,20:38
1650,340,7,1752,2,46:00,91,Richard Rios Montoya,Guarani,1246,20:46
1651,340,7,1753,2,48:00,93,Edson Guilherme Mendes dos Santos,Guarani,1248,20:48
1652,340,7,1754,1,45:00,45,Isaque Elias Brito,Guarani,1185,19:45
1653,340,9,1755,1,22:00,22,Bruno Roberto Pereira da Silva,Crb,1162,19:22
1654,341,2,1756,2,41:00,86,Lucas Alexandre Marques Otaviano,Csa,1241,20:41
1655,341,10,1757,2,40:00,85,Alan Luciano Ruschel,Londrina,1240,20:40
1656,342,4,1759,2,27:00,72,Ronaldo Henrique Ferreira da Silva,Sport,1047,17:27
1657,342,4,1760,1,45:00,45,Gustavo Coutinho Silva Lopes,Sport,1005,16:45
1658,342,22,1761,2,50:00,95,Raniel Santana de Vasconcelos,Vasco da Gama S.a.f.,1070,17:50
1659,343,3,1764,2,07:00,52,Lohan dos Santos Freire,Criciúma,1207,20:07
1660,343,19,1765,2,26:00,71,Jose Leonardo Verissimo do Nascimento,Ituano,1226,20:26
1661,344,11,1766,1,36:00,36,Djavan Aulim Candido de Souza,Náutico,1326,22:06
1662,344,8,1767,1,25:00,25,Daniel de Oliveira Sertanejo,Novorizontino,1315,21:55
1663,344,8,1768,2,25:00,70,Jhony Douglas Santiago,Novorizontino,1375,22:55
1664,344,8,1769,1,27:00,27,Diego Fabian Torres,Novorizontino,1317,21:57
1665,344,8,1770,1,31:00,31,Ronald Sant Anna Rodrigues,Novorizontino,1321,22:01
1666,344,8,1771,2,31:00,76,Romulo Azevedo Simao,Novorizontino,1381,23:01
1667,345,17,1772,2,46:00,91,Lucas Pereira Mendes,Operário,1396,23:16
1668,345,6,1773,1,31:00,31,Fernando Jose Marques Maciel,Brusque,1321,22:01
1669,345,6,1774,2,40:00,85,Angelo Samuel Chaves,Brusque,1390,23:10
1670,346,14,1775,2,13:00,58,Daniel Sampaio Simoes,Bahia,1033,17:13
1671,346,14,1776,2,34:00,79,Ricardo Goulart Pereira,Bahia,1054,17:34
1672,346,14,1777,1,43:00,43,Caio Vidal Rocha,Bahia,1003,16:43
1673,346,14,1778,2,49:00,94,Marcio Almeida de Oliveira,Bahia,1069,17:49
1674,346,14,1779,2,48:00,93,Mateus Eduardo Claus,Bahia,1068,17:48
1675,346,1,1780,2,02:00,47,Edilson Mendes Guimaraes,Grêmio,1022,17:02
1676,347,5,1781,1,15:00,15,Rafael Oliveira Silva,Sampaio Corrêa,1305,21:45
1677,347,5,1782,2,36:00,81,Anderson Wanderllan de Moraes Rodrigues,Sampaio Corrêa,1386,23:06
1678,347,18,1783,1,45:00,45,Willian Popp,Chapecoense,1335,22:15
1679,348,16,1784,2,22:00,67,Jociel Ferreira da Silva,Tombense,1072,17:52
1680,348,16,1785,2,36:00,81,Diego Ferreira Matheus,Tombense,1086,18:06
1681,348,16,1786,2,48:00,93,Kleiton Pego Duarte,Tombense,1098,18:18
1682,348,16,1787,2,47:00,92,Bruno Marques Fernandes Pivetti,Tombense,1097,18:17
1683,349,13,1788,1,35:00,35,Lucas Baptista Felix,Vila Nova,1265,21:05
1684,349,15,1789,2,25:00,70,Jair Diego Alves de Brito,Cruzeiro Saf,1315,21:55
1685,349,15,1790,1,39:00,39,Jose Ivaldo Almeida Silva,Cruzeiro Saf,1269,21:09
1686,350,0,1791,1,09:00,9,Luis Otavio de Oliveira,Ponte Preta,1299,21:39
1687,350,0,1792,1,10:00,10,Artur Sergio Batista de Souza,Ponte Preta,1300,21:40
1688,350,0,1793,2,20:00,65,Mateus Ferreira da Silva,Ponte Preta,1370,22:50
1689,350,0,1794,2,26:00,71,Igor Marques Paciencia Cardoso,Ponte Preta,1376,22:56
1690,350,0,1795,2,37:00,82,Cassio Gabriel Vilela Ferreira,Ponte Preta,1387,23:07
1691,350,0,1796,1,42:00,42,Norberto Pereira Marinho Neto,Ponte Preta,1332,22:12
1692,350,2,1797,2,34:00,79,Felipe Augusto Ferreira Batista,Csa,1384,23:04
1693,350,2,1798,2,35:00,80,Gabriel Santana Pinto,Csa,1385,23:05
1694,351,9,1800,2,12:00,57,Guilherme Kennedy Romao,Crb,1362,22:42
1695,351,9,1801,2,38:00,83,Claudinei Junio de Souza,Crb,1388,23:08
1696,351,17,1802,1,22:00,22,Paulo Victor Ferreira de Jesus,Operário,1312,21:52
1697,351,17,1803,2,37:00,82,Fabiano da Silva Souza,Operário,1387,23:07
1698,351,17,1804,1,48:00,48,Lucas do Carmo Souza,Operário,1338,22:18
1699,352,1,1805,2,20:00,65,Lucas Pezzini Leiva,Grêmio,1040,17:20
1700,352,1,1806,2,35:00,80,Lucas Silva Borges,Grêmio,1055,17:35
1701,352,11,1807,2,18:00,63,Julio Rodrigues de Albuquerque,Náutico,1038,17:18
1702,352,11,1808,1,30:00,30,Luiz Eduardo Barros Cavalcanti,Náutico,990,16:30
1703,353,6,1810,1,35:00,35,Gerson Rodolfo da Silva,Brusque,1175,19:35
1704,353,6,1811,2,38:00,83,Everton Paulo Strieder,Brusque,1238,20:38
1705,353,8,1812,2,37:00,82,Jose Walber Mota de Amorim,Novorizontino,1237,20:37
1706,353,8,1813,1,46:00,46,Willean Bernardo Willemen,Novorizontino,1186,19:46
1707,354,5,1814,2,24:00,69,Rafael Oliveira Silva,Sampaio Corrêa,1074,17:54
1708,354,19,1815,2,06:00,51,Lucas Santos Siqueira,Ituano,1056,17:36
1709,354,19,1816,2,08:00,53,Aylon Darwin Tavella,Ituano,1058,17:38
1710,354,19,1817,2,23:00,68,Caique de Jesus Goncalves,Ituano,1073,17:53
1711,355,4,1818,2,41:00,86,Willian Oliveira dos Santos,Sport,1091,18:11
1712,355,10,1819,2,42:00,87,Mauricio Caprini Pinto,Londrina,1092,18:12
1713,356,3,1820,2,03:00,48,Rayan Poltronieri Pereira,Criciúma,1053,17:33
1714,356,3,1821,2,05:00,50,Italo Melo Oliveira,Criciúma,1055,17:35
1715,356,3,1822,1,30:00,30,Helder Silva Santos,Criciúma,1020,17:00
1716,356,3,1823,2,34:00,79,Cristovam Roberto Ribeiro da Silva,Criciúma,1084,18:04
1717,356,22,1824,2,34:00,79,Edimar Curitiba Fraga,Vasco da Gama S.a.f.,1084,18:04
1718,356,22,1825,2,34:00,79,Carlosalonso Enrique Palacios Nunez,Vasco da Gama S.a.f.,1084,18:04
1719,356,22,1826,2,42:00,87,Fabio Roberto Gomes Netto,Vasco da Gama S.a.f.,1092,18:12
1720,357,14,1827,1,01:00,1,Luiz Henrique dos Santos Junior,Bahia,991,16:31
1721,357,14,1828,2,43:00,88,Daniel Sampaio Simoes,Bahia,1093,18:13
1722,357,13,1829,1,11:00,11,Lucas Baptista Felix,Vila Nova,1001,16:41
1723,357,13,1830,2,11:00,56,Hugo da Silva Cabral,Vila Nova,1061,17:41
1724,357,13,1831,2,12:00,57,Alex da Silva,Vila Nova,1062,17:42
1725,357,13,1832,1,25:00,25,Arthur Rodrigues Rezende,Vila Nova,1015,16:55
1726,358,7,1833,2,07:00,52,Yuri Jonathan Vitor Coelho,Guarani,1357,22:37
1727,358,7,1834,2,13:00,58,Richard Rios Montoya,Guarani,1363,22:43
1728,358,7,1835,2,15:00,60,Lucas Ramon Batista Silva,Guarani,1365,22:45
1729,358,7,1836,2,22:00,67,Mayksilvan da Silva Ferreira,Guarani,1372,22:52
1730,358,7,1837,2,40:00,85,Jenison de Jesus Brito E Brito,Guarani,1390,23:10
1731,358,7,1838,1,41:00,41,Leandro Vilela Sales Teixeira,Guarani,1331,22:11
1732,358,7,1839,2,44:00,89,Eduardo Luiz Person,Guarani,1394,23:14
1733,358,7,1840,2,48:00,93,Yago Cesar da Silva,Guarani,1398,23:18
1734,358,15,1841,1,16:00,16,Rafael Cabral Barbosa,Cruzeiro Saf,1306,21:46
1735,358,15,1842,2,20:00,65,Geovane de Jesus Rocha,Cruzeiro Saf,1370,22:50
1736,358,15,1843,1,34:00,34,Luiz Filipe da Rosa Machado,Cruzeiro Saf,1324,22:04
1737,358,15,1844,2,42:00,87,Breno Henrique Neres Teixeira,Cruzeiro Saf,1392,23:12
1738,359,18,1847,2,31:00,76,Felipe de Figueiredo Ferreira,Chapecoense,1246,20:46
1739,359,18,1848,1,46:00,46,Chrystian Amaral Barletta de Almeida,Chapecoense,1201,20:01
1740,359,18,1849,2,47:00,92,Luiz Henrique Mendes Silva da Costa,Chapecoense,1262,21:02
1741,359,16,1850,2,08:00,53,David Junio Manoel dos Santos,Tombense,1223,20:23
1742,359,16,1851,1,31:00,31,Jean Lucas Figueiredo,Tombense,1186,19:46
1743,359,16,1852,2,38:00,83,Guilherme Ribeiro Rend,Tombense,1253,20:53
1744,359,16,1853,1,45:00,45,Kleiton Pego Duarte,Tombense,1200,20:00
1745,360,3,1854,2,06:00,51,Marcos Vinicius Cerato,Criciúma,1356,22:36
1746,360,3,1855,2,49:00,94,Rayan Poltronieri Pereira,Criciúma,1399,23:19
1747,360,0,1856,2,05:00,50,Igor Marques Paciencia Cardoso,Ponte Preta,1355,22:35
1748,360,0,1857,1,26:00,26,Wesley Fraga,Ponte Preta,1316,21:56
1749,360,0,1858,2,49:00,94,Wallisson Luiz Alves Maximo,Ponte Preta,1399,23:19
1750,361,2,1859,1,20:00,20,Lucas Lourenco Andrade,Csa,1310,21:50
1751,361,2,1860,2,25:00,70,Luiz Henrique Beserra dos Santos,Csa,1375,22:55
1752,361,2,1861,2,49:00,94,Elton Rodrigues Brandao,Csa,1399,23:19
1753,362,4,1862,2,14:00,59,Facundo Labandeira Castro,Sport,1214,20:14
1754,362,4,1863,1,40:00,40,Ronaldo Henrique Ferreira da Silva,Sport,1180,19:40
1755,362,17,1864,2,39:00,84,Renie Almeida da Silva,Operário,1239,20:39
1756,362,17,1865,1,40:00,40,Javier Arley Reina Calvo,Operário,1180,19:40
1757,362,17,1866,1,41:00,41,Fernando Jose da Cunha Neto,Operário,1181,19:41
1758,363,9,1867,2,05:00,50,Maycon Douglas Oliveira Silva,Crb,1205,20:05
1759,363,9,1868,2,35:00,80,Raul Prata,Crb,1235,20:35
1760,363,6,1869,2,08:00,53,Felipe Manoel Goncalves,Brusque,1208,20:08
1761,363,6,1870,2,38:00,83,Matheus Trindade Gonçalves,Brusque,1238,20:38
1762,363,6,1871,2,40:00,85,Wallace Reis Silva,Brusque,1240,20:40
1763,364,8,1873,2,04:00,49,Romario Guilherme dos Santos,Novorizontino,1204,20:04
1764,364,15,1874,2,13:00,58,Jose Ivaldo Almeida Silva,Cruzeiro Saf,1213,20:13
1765,365,10,1875,2,19:00,64,Mauricio Caprini Pinto,Londrina,1219,20:19
1766,365,10,1876,1,30:00,30,Luiz Gustavo da Silva Machado Duarte,Londrina,1170,19:30
1767,365,10,1877,1,31:00,31,Jeferson de Araujo de Carvalho,Londrina,1171,19:31
1768,365,19,1878,1,31:00,31,Gabriel de Sousa Barros,Ituano,1171,19:31
1769,365,19,1879,2,31:00,76,Roberto Heuchayer Santos de Araujo,Ituano,1231,20:31
1770,365,19,1880,1,44:00,44,Rafael Pereira dos Santos,Ituano,1184,19:44
1771,366,5,1881,2,12:00,57,Rafael Oliveira Silva,Sampaio Corrêa,1377,22:57
1772,366,5,1882,1,31:00,31,Joecio Barbosa dos Santos,Sampaio Corrêa,1336,22:16
1773,366,5,1883,1,47:00,47,Leandro Ferreira Pessoa,Sampaio Corrêa,1352,22:32
1774,366,22,1884,1,16:00,16,Edimar Curitiba Fraga,Vasco da Gama S.a.f.,1321,22:01
1775,366,22,1885,2,35:00,80,Bruno Nunes de Barros,Vasco da Gama S.a.f.,1400,23:20
1776,366,22,1886,2,36:00,81,Juan Sebastian Quintero Fletcher,Vasco da Gama S.a.f.,1401,23:21
1777,367,14,1887,1,39:00,39,Marcio Almeida de Oliveira,Bahia,1179,19:39
1778,367,14,1888,2,42:00,87,Miqueias Cabral Evaristo,Bahia,1242,20:42
